,db_id,original_sql
37,tpch,"SELECT MIN(l.l_tax) AS min_l_l_tax, MAX(l.l_linenumber) AS max_l_l_linenumber, COUNT(c.c_phone) AS count_c_c_phone, COUNT(c.c_mktsegment) AS count_c_c_mktsegment, COUNT(c.c_nationkey) AS count_c_c_nationkey FROM customer c, lineitem l, orders o, supplier s WHERE s.s_acctbal = (SELECT COUNT(*) FROM (SELECT s_suppkey FROM supplier WHERE s_nationkey IN (SELECT n_nationkey FROM nation WHERE n_regionkey = 4) UNION ALL SELECT ps_suppkey FROM partsupp WHERE ps_supplycost > 500) t) AND o.o_custkey > (SELECT COUNT(*) FROM (SELECT c_nationkey FROM customer UNION ALL SELECT n_regionkey FROM nation ) t) AND o.o_custkey = (SELECT COUNT(DISTINCT n_nationkey) FROM nation JOIN (SELECT c_nationkey FROM customer WHERE c_acctbal > 5000 UNION ALL SELECT c_nationkey FROM customer WHERE c_mktsegment = 'AUTOMOBILE') AS subq_3 ON nation.n_nationkey = subq_3.c_nationkey) AND o.o_orderstatus IN (SELECT DISTINCT o_orderstatus FROM orders UNION SELECT l_linestatus FROM lineitem UNION SELECT l_linestatus FROM (SELECT DISTINCT l_linestatus FROM lineitem AS l1_4 WHERE l_extendedprice > 500) AS subq_4) AND l.l_orderkey = (SELECT (20 * 5) + COUNT(DISTINCT l_linenumber) FROM lineitem WHERE l_extendedprice IN (SELECT p_retailprice FROM part WHERE p_size < 15)) AND EXISTS (SELECT DISTINCT c_comment FROM customer UNION SELECT DISTINCT n_name FROM nation WHERE n_regionkey = 4 UNION SELECT DISTINCT p_container FROM part WHERE p_size > 15) AND c.c_custkey > (SELECT (10 * 7) + COUNT(DISTINCT p_partkey) FROM part WHERE p_size IN (SELECT l_quantity FROM lineitem WHERE l_shipdate > '1995-01-01')) AND EXISTS (SELECT l_shipmode FROM (SELECT l_shipmode FROM lineitem WHERE l_orderkey IN (SELECT o_orderkey FROM orders WHERE o_orderdate < '1994-01-01' ) UNION ALL SELECT l_shipmode FROM lineitem WHERE l_quantity > 25) t GROUP BY l_shipmode ORDER BY l_shipmode) AND c.c_address IN (SELECT c_address FROM customer WHERE c_custkey IN (SELECT o_custkey FROM orders WHERE o_totalprice > 10000 ) UNION SELECT c_address FROM customer WHERE c_custkey IN (SELECT o_custkey FROM orders WHERE o_totalprice < 10000 ) ORDER BY c_address) AND s.s_name IN (SELECT s_name FROM supplier WHERE s_suppkey IN (SELECT ps_suppkey FROM partsupp WHERE ps_supplycost > 70 UNION SELECT s_suppkey FROM supplier WHERE s_acctbal > 4000) AND s_nationkey IN (SELECT n_nationkey FROM nation JOIN region ON n_regionkey = r_regionkey WHERE r_name = 'ASIA')) AND o.o_orderkey = l.l_orderkey AND o.o_custkey = c.c_custkey AND l.l_commitdate > '1997-06-11' AND c.c_mktsegment LIKE 'HOUSEHOLD%' AND s.s_suppkey >= 1540 AND s.s_acctbal < 2128.8470861209416 AND s.s_name LIKE 'Supplier#000007956%' AND o.o_orderdate <= '1992-10-15' AND o.o_custkey <= 127614 AND o.o_orderkey <= 1204792 AND l.l_shipmode LIKE 'TRUCK%' AND o.o_orderstatus LIKE 'F%'  LIMIT 10;"
38,tpch,"SELECT COUNT(s.s_name) AS count_s_s_name, s.s_suppkey AS s_s_suppkey, s.s_comment AS s_s_comment, SUM(s.s_suppkey) AS sum_s_s_suppkey, COUNT(n.n_nationkey) AS count_n_n_nationkey FROM nation n, supplier s WHERE EXISTS (SELECT n_1.n_name FROM nation n_1 WHERE n_1.n_nationkey IN (SELECT c_1.c_nationkey FROM customer c_1 WHERE c_1.c_acctbal > 500 UNION ALL SELECT s_1.s_nationkey FROM supplier s_1 WHERE s_1.s_acctbal < 1000 GROUP BY s_1.s_nationkey) AND n_1.n_regionkey = 2) AND EXISTS (SELECT c_comment FROM (SELECT c_comment, c_custkey FROM customer ) AS subq_2 UNION SELECT l_shipmode FROM lineitem) AND n.n_nationkey = (SELECT COUNT(DISTINCT c_custkey) FROM customer JOIN (SELECT o_custkey FROM orders WHERE o_totalprice > 1000 UNION ALL SELECT o_custkey FROM orders WHERE o_orderdate > '1995-01-01') AS subq_3 ON customer.c_custkey = subq_3.o_custkey) AND s.s_suppkey = (SELECT COUNT(*) FROM (SELECT o_orderpriority FROM orders UNION ALL SELECT p_container FROM part ) t) AND EXISTS (SELECT c_comment FROM (SELECT c_comment, c_nationkey FROM customer WHERE c_nationkey = 5 ) AS subq_5 WHERE c_nationkey > 4 ORDER BY c_nationkey) AND EXISTS (SELECT o_orderkey FROM orders WHERE o_custkey IN (SELECT c_custkey FROM customer WHERE c_acctbal > 1000 UNION SELECT o_custkey FROM orders WHERE o_orderdate > '1996-01-01') AND o_orderstatus IN (SELECT o_orderstatus FROM orders JOIN customer ON o_custkey = c_custkey WHERE c_mktsegment = 'BUILDING')) AND EXISTS (SELECT SUM(l_extendedprice) FROM (SELECT l_extendedprice, l_returnflag FROM lineitem WHERE l_shipdate < '1995-01-01' UNION ALL SELECT l_extendedprice, l_returnflag FROM lineitem WHERE l_shipdate >= '1995-01-01' GROUP BY l_extendedprice, l_returnflag) t JOIN (SELECT o_orderkey, o_orderstatus FROM orders) o ON t.l_extendedprice = o.o_orderkey GROUP BY o.o_orderstatus) AND EXISTS (SELECT AVG(p_retailprice) FROM (SELECT p_retailprice, p_type FROM part WHERE p_size < 20 UNION ALL SELECT p_retailprice, p_type FROM part WHERE p_size >= 20 GROUP BY p_retailprice, p_type) p JOIN (SELECT ps_partkey, ps_supplycost FROM partsupp) ps ON p.p_retailprice = ps.ps_partkey GROUP BY ps.ps_supplycost) AND EXISTS (SELECT c_comment FROM customer WHERE c_custkey IN (SELECT o_custkey FROM orders WHERE o_orderdate > '1996-01-01' UNION SELECT o_custkey FROM orders WHERE o_orderpriority = '4-NOT SPECIFIED')) AND EXISTS (SELECT COUNT(DISTINCT o_orderkey) FROM orders WHERE o_orderpriority = '1-URGENT' UNION SELECT COUNT(DISTINCT ps_partkey) FROM partsupp WHERE ps_supplycost > 100) AND s.s_nationkey = n.n_nationkey AND s.s_suppkey > 1626 AND s.s_suppkey < 3542 AND s.s_name LIKE 'Supplier#000006362%' AND s.s_nationkey > 5 AND s.s_nationkey < 7 AND s.s_acctbal > 2174.682293253907 AND s.s_acctbal < 8705.832894383992 AND n.n_nationkey > 17 AND n.n_nationkey < 23 AND n.n_name LIKE 'EGYPT%'  GROUP BY s.s_suppkey, s.s_comment LIMIT 30;"
39,tpch,"SELECT MAX(l.l_shipmode) AS max_l_l_shipmode, AVG(r.r_regionkey) AS avg_r_r_regionkey, r.r_regionkey AS r_r_regionkey, MAX(n.n_regionkey) AS max_n_n_regionkey, SUM(l.l_orderkey) AS sum_l_l_orderkey FROM lineitem l, nation n, part p, region r WHERE p.p_size > (SELECT COUNT(DISTINCT s_suppkey) FROM supplier WHERE s_nationkey IN (SELECT n_nationkey FROM nation WHERE n_regionkey = 1) AND s_acctbal > 4000 AND s_phone LIKE '18%') AND EXISTS (SELECT r_name FROM (SELECT r_name, r_regionkey FROM region WHERE r_regionkey = 2 ) AS subq_2 WHERE r_regionkey > 1 ORDER BY r_regionkey) AND EXISTS (SELECT COUNT(*) FROM (SELECT c_phone FROM customer UNION SELECT s_phone FROM (SELECT s_phone, COUNT(*) FROM supplier GROUP BY s_phone HAVING COUNT(*) > 1) AS subq_3) AS t_3) AND n.n_regionkey = (SELECT (10 * 5) + COUNT(DISTINCT l_orderkey) FROM lineitem WHERE l_partkey IN (SELECT p_partkey FROM part WHERE p_size > 20)) AND p.p_retailprice = (SELECT COUNT(DISTINCT p_type) FROM part JOIN (SELECT ps_partkey FROM partsupp UNION ALL SELECT ps_partkey FROM partsupp WHERE ps_availqty > 100) AS partsupp_union_5 ON part.p_partkey = partsupp_union_5.ps_partkey) AND EXISTS (SELECT DISTINCT o_orderstatus FROM orders UNION SELECT l_linestatus FROM lineitem UNION SELECT l_linestatus FROM (SELECT DISTINCT l_linestatus FROM lineitem AS l1_6 WHERE l_extendedprice > 500) AS subq_6) AND r.r_regionkey = (SELECT COUNT(DISTINCT p_partkey) FROM (SELECT p_partkey, p_name FROM part WHERE p_size > 20 ) t) AND EXISTS (SELECT MAX(p_size) FROM (SELECT p_size, p_type FROM part JOIN lineitem ON p_partkey = l_partkey WHERE p_retailprice > 100 ) AS t_8 GROUP BY p_type ORDER BY p_type) AND p.p_brand IN (SELECT DISTINCT p_brand FROM part UNION SELECT s_phone FROM supplier UNION SELECT s_phone FROM (SELECT DISTINCT s_phone FROM supplier AS s1_9 WHERE s_nationkey = 3) AS subq_9) AND l.l_suppkey = (SELECT COUNT(*) FROM (SELECT s_name FROM supplier UNION ALL SELECT p_name FROM part ) t) AND n.n_regionkey = r.r_regionkey AND l.l_shipinstruct LIKE 'NONE%' AND l.l_linestatus LIKE 'F%' AND l.l_linenumber >= 5 AND r.r_name LIKE 'AMERICA%' AND p.p_partkey < 109161 AND l.l_commitdate > '1998-09-08' AND l.l_discount <= 0.06771631462412214 AND l.l_orderkey <= 5636193 AND p.p_container LIKE 'LG DRUM%' AND l.l_returnflag LIKE 'A%'  GROUP BY r.r_regionkey LIMIT 100;"
40,tpch,"SELECT MAX(s.s_nationkey) AS max_s_s_nationkey, MAX(l.l_receiptDATE) AS max_l_l_receiptDATE, MAX(l.l_quantity) AS max_l_l_quantity, COUNT(l.l_comment) AS count_l_l_comment, l.l_linestatus AS l_l_linestatus FROM lineitem l, nation n, partsupp ps, supplier s WHERE s.s_name IN (SELECT s_name FROM supplier WHERE s_suppkey IN (SELECT ps_suppkey FROM partsupp WHERE ps_supplycost > 100 ) UNION SELECT s_name FROM supplier WHERE s_suppkey IN (SELECT ps_suppkey FROM partsupp WHERE ps_supplycost < 100 ) ORDER BY s_name) AND EXISTS (SELECT COUNT(DISTINCT o_custkey) FROM orders WHERE o_orderstatus = 'O' UNION ALL SELECT COUNT(DISTINCT l_linenumber) FROM lineitem WHERE l_shipmode = 'TRUCK' UNION ALL SELECT 0 FROM part WHERE p_size = 15) AND EXISTS (SELECT c_mktsegment FROM customer WHERE c_custkey IN (SELECT o_custkey FROM orders WHERE o_orderdate < '1994-01-01' UNION SELECT c_custkey FROM customer WHERE c_acctbal > 5000)) AND n.n_nationkey = (SELECT COUNT(DISTINCT c_custkey) FROM customer WHERE c_acctbal < 3000 AND (c_mktsegment = 'FURNITURE' OR c_mktsegment = 'HOUSEHOLD') AND c_phone LIKE '30%') AND l.l_discount IN (SELECT l_discount FROM (SELECT l_discount, l_quantity FROM lineitem WHERE l_quantity = 15 ) AS subq_5 WHERE l_quantity > 10 ORDER BY l_quantity) AND EXISTS (SELECT AVG(l_extendedprice) FROM (SELECT l_extendedprice, l_shipmode FROM lineitem JOIN supplier ON l_suppkey = s_suppkey WHERE l_tax > 0.02 ) AS t_6 GROUP BY l_shipmode ORDER BY l_shipmode) AND EXISTS (SELECT l_shipinstruct FROM (SELECT l_shipinstruct, l_discount FROM lineitem ) AS subq_7 UNION SELECT r_comment FROM region) AND ps.ps_partkey > (SELECT COUNT(DISTINCT c_custkey) FROM customer WHERE c_acctbal > 2000 AND (c_nationkey = 10 OR c_nationkey = 15) AND 3+4=7 AND c_nationkey IN (SELECT n_nationkey FROM nation WHERE n_regionkey = 3 AND 5*6=30)) AND EXISTS (SELECT SUM(ps_supplycost) FROM (SELECT ps_supplycost, ps_partkey FROM partsupp JOIN supplier ON ps_suppkey = s_suppkey WHERE s_nationkey = 4 UNION SELECT ps_supplycost, ps_partkey FROM partsupp JOIN part ON ps_partkey = p_partkey WHERE p_size < 15 AND p_type IN (SELECT p_type FROM part WHERE p_retailprice > 100)) AS subq_9 GROUP BY ps_partkey) AND EXISTS (SELECT COUNT(l_linenumber) FROM (SELECT l_linenumber, l_returnflag FROM lineitem JOIN orders ON l_orderkey = o_orderkey WHERE l_discount < 0.1 ) AS t_10 GROUP BY l_returnflag ORDER BY l_returnflag) AND s.s_nationkey = n.n_nationkey AND s.s_suppkey = ps.ps_suppkey AND l.l_partkey = ps.ps_partkey AND l.l_suppkey = ps.ps_suppkey AND s.s_name LIKE 'Supplier#000008397%' AND ps.ps_availqty > 8862 AND s.s_acctbal > 9675.729489848734 AND l.l_commitdate > '1998-08-21' AND l.l_returnflag LIKE 'N%' AND ps.ps_suppkey = 4691 AND l.l_shipmode LIKE 'AIR%' AND l.l_linestatus LIKE 'F%' AND ps.ps_supplycost = 495.7509888816273 AND l.l_tax = 0.07369929603189355  GROUP BY l.l_linestatus LIMIT 10;"
41,tpch,"SELECT COUNT(p.p_size) AS count_p_p_size, AVG(p.p_partkey) AS avg_p_p_partkey, MIN(s.s_nationkey) AS min_s_s_nationkey, MAX(s.s_phone) AS max_s_s_phone, MIN(s.s_suppkey) AS min_s_s_suppkey FROM part p, supplier s WHERE EXISTS (SELECT MAX(l_discount) FROM (SELECT l_discount, l_shipmode FROM lineitem WHERE l_commitdate BETWEEN DATE '1993-01-01' AND DATE '1993-12-31' ) t GROUP BY l_shipmode ORDER BY l_shipmode) AND EXISTS (SELECT DISTINCT p_brand FROM part UNION SELECT s_phone FROM supplier UNION SELECT s_phone FROM (SELECT DISTINCT s_phone FROM supplier AS s1_2 WHERE s_nationkey = 3) AS subq_2) AND EXISTS (SELECT n_comment FROM (SELECT n_comment FROM nation WHERE n_nationkey IN (SELECT c_nationkey FROM customer WHERE c_acctbal < 3000 UNION SELECT s_nationkey FROM supplier WHERE s_acctbal > 2000) UNION ALL SELECT n_comment FROM nation WHERE n_nationkey IN (SELECT c_nationkey FROM customer WHERE c_mktsegment = 'BUILDING' UNION ALL SELECT s_nationkey FROM supplier WHERE s_phone LIKE '30%')) t GROUP BY n_comment) AND EXISTS (SELECT p_mfgr FROM (SELECT p_mfgr FROM part WHERE p_partkey IN (SELECT l_partkey FROM lineitem WHERE l_shipdate > '1997-06-30' UNION SELECT l_partkey FROM lineitem WHERE l_discount < 0.05) UNION ALL SELECT p_mfgr FROM part WHERE p_partkey IN (SELECT l_partkey FROM lineitem WHERE l_returnflag = 'Y' UNION ALL SELECT l_partkey FROM lineitem WHERE l_linestatus = 'F')) t GROUP BY p_mfgr) AND EXISTS (SELECT n_name FROM (SELECT n_name, n_regionkey FROM nation ) AS subq_5 UNION SELECT p_container FROM part) AND s.s_nationkey > (SELECT COUNT(DISTINCT s_suppkey) FROM supplier WHERE s_nationkey IN (SELECT n_nationkey FROM nation WHERE n_regionkey = 1) AND s_acctbal > 4000 AND s_phone LIKE '18%') AND EXISTS (SELECT o_orderstatus FROM (SELECT o_orderstatus, o_totalprice FROM orders WHERE o_totalprice = 5000 ) AS subq_7 WHERE o_totalprice > 3000 ORDER BY o_totalprice) AND EXISTS (SELECT l_shipinstruct FROM (SELECT l_shipinstruct, l_discount FROM lineitem ) AS subq_8 UNION SELECT r_comment FROM region) AND p.p_type IN (SELECT p_type FROM (SELECT p_type, p_size FROM part ) AS subq_9 UNION SELECT s_name FROM supplier) AND EXISTS (SELECT o_orderpriority FROM (SELECT o_orderpriority FROM orders WHERE o_orderkey IN (SELECT l_orderkey FROM lineitem WHERE l_commitdate < '1995-03-15' ) UNION ALL SELECT o_orderpriority FROM orders WHERE o_totalprice > 1000) t GROUP BY o_orderpriority ORDER BY o_orderpriority) AND p.p_name LIKE 'hot indian blanched powder maroon%' AND s.s_acctbal = 8497.916103363821 AND p.p_size < 35 AND p.p_brand LIKE 'Brand#32%' AND p.p_retailprice = 1136.765377425477 AND s.s_suppkey >= 4519 AND p.p_type LIKE 'LARGE POLISHED COPPER%' AND p.p_mfgr LIKE 'Manufacturer#5%' AND p.p_partkey > 147670 AND p.p_container LIKE 'JUMBO PACK%'  LIMIT 50;"
42,tpch,"SELECT MAX(l.l_receiptDATE) AS max_l_l_receiptDATE, COUNT(c.c_acctbal) AS count_c_c_acctbal, SUM(s.s_acctbal) AS sum_s_s_acctbal, MAX(l.l_suppkey) AS max_l_l_suppkey, c.c_acctbal AS c_c_acctbal FROM customer c, lineitem l, part p, supplier s WHERE EXISTS (SELECT c_phone FROM (SELECT c_phone, c_acctbal FROM customer WHERE c_acctbal = 1000 ) AS subq_1 WHERE c_acctbal > 500 ORDER BY c_acctbal) AND EXISTS (SELECT AVG(p_retailprice) FROM (SELECT p_retailprice, p_type FROM part WHERE p_size < 20 UNION ALL SELECT p_retailprice, p_type FROM part WHERE p_size >= 20 GROUP BY p_retailprice, p_type) p JOIN (SELECT ps_partkey, ps_supplycost FROM partsupp) ps ON p.p_retailprice = ps.ps_partkey GROUP BY ps.ps_supplycost) AND EXISTS (SELECT l_linestatus FROM (SELECT l_linestatus FROM lineitem WHERE l_orderkey IN (SELECT o_orderkey FROM orders WHERE o_orderdate > '1997-01-01' ) UNION ALL SELECT l_linestatus FROM lineitem WHERE l_tax > 0.02) t GROUP BY l_linestatus ORDER BY l_linestatus) AND EXISTS (SELECT SUM(o_totalprice) FROM (SELECT o_totalprice, o_orderstatus FROM orders WHERE o_orderdate >= DATE '1995-01-01' ) t GROUP BY o_orderstatus ORDER BY o_orderstatus) AND EXISTS (SELECT c_comment FROM customer WHERE c_custkey IN (SELECT o_custkey FROM orders WHERE o_orderdate > '1998-01-01' ) UNION SELECT c_comment FROM customer WHERE c_custkey IN (SELECT o_custkey FROM orders WHERE o_orderdate < '1998-01-01' ) ORDER BY c_comment) AND EXISTS (SELECT COUNT(*) FROM (SELECT p_partkey FROM part UNION SELECT ps_partkey FROM (SELECT ps_partkey, COUNT(*) FROM partsupp GROUP BY ps_partkey HAVING COUNT(*) > 3) AS subq_6) AS t_6) AND s.s_name IN (SELECT s_name FROM supplier WHERE s_suppkey IN (SELECT ps_suppkey FROM partsupp WHERE ps_availqty > 75 ) UNION SELECT s_name FROM supplier WHERE s_suppkey IN (SELECT ps_suppkey FROM partsupp WHERE ps_availqty < 75 ) ORDER BY s_name) AND l.l_orderkey = (SELECT COUNT(DISTINCT l_orderkey) FROM lineitem WHERE l_partkey IN (SELECT p_partkey FROM part WHERE p_type LIKE 'MEDIUM%') AND l_suppkey IN (SELECT s_suppkey FROM supplier WHERE s_acctbal > 5000) AND l_quantity > 20) AND p.p_retailprice = (SELECT COUNT(DISTINCT c_custkey) FROM (SELECT c_custkey FROM customer WHERE c_acctbal < 3000 UNION ALL SELECT o_custkey FROM orders WHERE o_totalprice > 5000) t JOIN nation ON n_nationkey = t.c_custkey) AND c.c_address IN (SELECT DISTINCT c_address FROM customer UNION SELECT DISTINCT n_comment FROM nation WHERE n_regionkey = 3 UNION SELECT DISTINCT p_mfgr FROM part WHERE p_size < 8) AND l.l_linestatus LIKE 'F%' AND c.c_name LIKE 'Customer#000016613%' AND p.p_partkey > 109180 AND l.l_commitdate <= '1998-03-29' AND c.c_acctbal > 8989.577782561073 AND s.s_name LIKE 'Supplier#000002383%' AND l.l_orderkey >= 2365503 AND l.l_shipdate <= '1992-12-27' AND s.s_suppkey >= 970 AND l.l_extendedprice > 97681.75536973606  GROUP BY c.c_acctbal LIMIT 10;"
43,tpch,"SELECT MIN(c.c_custkey) AS min_c_c_custkey, SUM(o.o_orderkey) AS sum_o_o_orderkey, MIN(n.n_nationkey) AS min_n_n_nationkey, s.s_comment AS s_s_comment, COUNT(l.l_linestatus) AS count_l_l_linestatus FROM customer c, lineitem l, nation n, orders o, supplier s WHERE EXISTS (SELECT COUNT(*) FROM (SELECT p_name FROM part UNION SELECT p_type FROM (SELECT p_type, COUNT(*) FROM part GROUP BY p_type HAVING COUNT(*) > 6) AS subq_1) AS t_1) AND s.s_address IN (SELECT s_address FROM supplier WHERE s_suppkey IN (SELECT ps_suppkey FROM partsupp WHERE ps_supplycost > 200 ) UNION SELECT s_address FROM supplier WHERE s_suppkey IN (SELECT ps_suppkey FROM partsupp WHERE ps_supplycost < 200 ) ORDER BY s_address) AND n.n_name IN (SELECT n_name FROM (SELECT n_name, n_regionkey FROM nation ) AS subq_3 UNION SELECT p_container FROM part) AND c.c_nationkey > (SELECT COUNT(DISTINCT s_suppkey) FROM (SELECT s_suppkey, s_phone FROM supplier WHERE s_acctbal < 3000 ) t) AND o.o_clerk IN (SELECT o_clerk FROM (SELECT o_clerk, o_totalprice FROM orders ) AS subq_5 UNION SELECT p_name FROM part) AND n.n_comment IN (SELECT n_comment FROM nation WHERE n_nationkey IN (SELECT s_nationkey FROM supplier WHERE s_acctbal > 2000 ) UNION SELECT n_comment FROM nation WHERE n_nationkey IN (SELECT s_nationkey FROM supplier WHERE s_acctbal < 2000 ) ORDER BY n_comment) AND c.c_nationkey > (SELECT COUNT(DISTINCT c_custkey) FROM (SELECT c_custkey, c_address FROM customer WHERE c_acctbal < 1000 ) t) AND EXISTS (SELECT o_orderpriority FROM (SELECT o_orderpriority FROM orders WHERE o_orderkey IN (SELECT l_orderkey FROM lineitem WHERE l_commitdate < '1995-03-15' ) UNION ALL SELECT o_orderpriority FROM orders WHERE o_totalprice > 1000) t GROUP BY o_orderpriority ORDER BY o_orderpriority) AND EXISTS (SELECT DISTINCT l_extendedprice FROM (SELECT l_extendedprice FROM lineitem UNION ALL SELECT o_totalprice FROM orders) AS u_9 JOIN partsupp ON u_9.l_extendedprice = ps_supplycost) AND l.l_orderkey > (SELECT COUNT(DISTINCT s_suppkey) FROM supplier WHERE s_acctbal > 800 AND (s_nationkey = 4 OR s_nationkey = 8) AND 3+5=8 AND s_nationkey IN (SELECT n_nationkey FROM nation WHERE n_regionkey = 2 AND 4*6=24)) AND n.n_nationkey = s.s_nationkey AND n.n_nationkey = c.c_nationkey AND o.o_orderkey = l.l_orderkey AND o.o_custkey = c.c_custkey AND n.n_nationkey = 2 AND l.l_commitdate <= '1997-11-01' AND o.o_totalprice <= 358310.67528690246 AND o.o_orderkey = 2044737 AND c.c_name LIKE 'Customer#000006063%' AND n.n_regionkey < 0 AND o.o_orderpriority LIKE '2-HIGH%' AND o.o_orderdate < '1995-08-07' AND l.l_discount = 0.09270894438791613 AND l.l_tax < 0.009170810528694418  GROUP BY s.s_comment LIMIT 10;"
44,tpch,"SELECT AVG(ps.ps_partkey) AS avg_ps_ps_partkey, MAX(l.l_shipmode) AS max_l_l_shipmode, MAX(l.l_linestatus) AS max_l_l_linestatus, AVG(l.l_suppkey) AS avg_l_l_suppkey, MIN(ps.ps_availqty) AS min_ps_ps_availqty FROM customer c, lineitem l, partsupp ps WHERE l.l_partkey = (SELECT COUNT(DISTINCT p_size) FROM part JOIN (SELECT ps_partkey FROM partsupp UNION ALL SELECT ps_partkey FROM partsupp WHERE ps_supplycost < 10) AS partsupp_union_1 ON part.p_partkey = partsupp_union_1.ps_partkey) AND l.l_linenumber > (SELECT COUNT(DISTINCT o_custkey) FROM (SELECT o_custkey FROM orders WHERE o_totalprice > 2000 UNION ALL SELECT c_custkey FROM customer WHERE c_acctbal < 3000) t JOIN nation ON n_nationkey = t.o_custkey) AND EXISTS (SELECT SUM(l_extendedprice) FROM (SELECT l_extendedprice, l_returnflag FROM lineitem JOIN orders ON l_orderkey = o_orderkey ) AS t_3 GROUP BY l_returnflag ORDER BY l_returnflag) AND c.c_address IN (SELECT c_address FROM customer WHERE c_custkey IN (SELECT o_custkey FROM orders WHERE o_totalprice > 10000 ) UNION SELECT c_address FROM customer WHERE c_custkey IN (SELECT o_custkey FROM orders WHERE o_totalprice < 10000 ) ORDER BY c_address) AND l.l_partkey > (SELECT COUNT(DISTINCT o_custkey) FROM (SELECT o_custkey, o_totalprice FROM orders WHERE o_totalprice > 50000 ) t) AND EXISTS (SELECT c_phone FROM (SELECT c_phone, c_mktsegment FROM customer ) AS subq_6 UNION SELECT p_type FROM part) AND ps.ps_supplycost > (SELECT COUNT(DISTINCT c_custkey) FROM (SELECT c_custkey FROM customer WHERE c_acctbal > 5000 UNION ALL SELECT o_custkey FROM orders WHERE o_totalprice < 1000) t JOIN nation ON n_nationkey = t.c_custkey) AND EXISTS (SELECT MIN(p_size) FROM (SELECT p_size, p_container FROM part JOIN lineitem ON p_partkey = l_partkey WHERE p_retailprice < 50 ) AS t_8 GROUP BY p_container ORDER BY p_container) AND EXISTS (SELECT MAX(p_size) FROM (SELECT p_size, p_type FROM part JOIN lineitem ON p_partkey = l_partkey WHERE p_retailprice > 100 ) AS t_9 GROUP BY p_type ORDER BY p_type) AND EXISTS (SELECT COUNT(s_suppkey) FROM (SELECT s_suppkey, s_nationkey FROM supplier JOIN nation ON s_nationkey = n_nationkey WHERE s_acctbal < 5000 ) AS t_10 GROUP BY s_nationkey ORDER BY s_nationkey) AND l.l_partkey = ps.ps_partkey AND l.l_suppkey = ps.ps_suppkey AND l.l_partkey <= 169957 AND l.l_linestatus LIKE 'F%' AND l.l_linenumber > 3 AND l.l_shipinstruct LIKE 'TAKE BACK RETURN%' AND c.c_custkey <= 25591 AND l.l_quantity <= 33.68085754229554 AND ps.ps_supplycost < 766.9125084703844 AND l.l_returnflag LIKE 'A%' AND l.l_discount > 0.023967147485240328 AND l.l_orderkey <= 4559802  LIMIT 50;"
45,tpch,"SELECT COUNT(p.p_size) AS count_p_p_size, c.c_acctbal AS c_c_acctbal, AVG(l.l_quantity) AS avg_l_l_quantity, COUNT(p.p_retailprice) AS count_p_p_retailprice, AVG(c.c_acctbal) AS avg_c_c_acctbal FROM customer c, lineitem l, orders o, part p, region r WHERE o.o_custkey > (SELECT COUNT(DISTINCT p_partkey) FROM part JOIN (SELECT ps_partkey FROM partsupp WHERE ps_supplycost < 30 UNION ALL SELECT ps_partkey FROM partsupp WHERE ps_availqty > 200) AS partsupp_union_1 ON part.p_partkey = partsupp_union_1.ps_partkey) AND c.c_nationkey > (SELECT COUNT(DISTINCT c_custkey) FROM customer WHERE c_acctbal < 3000 AND (c_nationkey = 15 OR c_nationkey = 20) AND 5+5=10 AND c_nationkey IN (SELECT n_nationkey FROM nation WHERE n_regionkey = 2 AND 6*7=42)) AND o.o_custkey = (SELECT COUNT(DISTINCT l_orderkey) FROM lineitem WHERE l_partkey IN (SELECT p_partkey FROM part WHERE p_type LIKE 'MEDIUM%') AND l_suppkey IN (SELECT s_suppkey FROM supplier WHERE s_acctbal > 5000) AND l_quantity > 20) AND l.l_quantity = (SELECT COUNT(DISTINCT ps_partkey) FROM partsupp WHERE ps_supplycost > 50 AND (ps_availqty = 100 OR ps_availqty = 200) AND ps_comment LIKE 'Special%') AND EXISTS (SELECT MAX(c_acctbal) FROM (SELECT c_acctbal, c_mktsegment FROM customer WHERE c_nationkey BETWEEN 10 AND 20 ) t GROUP BY c_mktsegment ORDER BY c_mktsegment) AND p.p_name IN (SELECT DISTINCT p_name FROM part UNION SELECT s_comment FROM supplier UNION SELECT s_comment FROM (SELECT DISTINCT s_comment FROM supplier AS s1_6 WHERE s_acctbal > 3000) AS subq_6) AND l.l_tax > (SELECT COUNT(DISTINCT s_nationkey) FROM (SELECT s_nationkey, s_address FROM supplier WHERE s_acctbal > 7000 ) t) AND r.r_regionkey > (SELECT COUNT(*) FROM (SELECT p_size FROM part UNION ALL SELECT l_quantity FROM lineitem ) t) AND EXISTS (SELECT o_9.o_clerk FROM orders o_9 WHERE o_9.o_orderkey IN (SELECT l_9.l_orderkey FROM lineitem l_9 WHERE l_9.l_discount > 0.05 UNION ALL SELECT l2_9.l_orderkey FROM lineitem l2_9 WHERE l2_9.l_shipdate < DATE '1995-06-01' GROUP BY l2_9.l_orderkey) AND o_9.o_totalprice < 5000) AND l.l_discount > (SELECT COUNT(DISTINCT s_suppkey) FROM supplier JOIN (SELECT ps_suppkey FROM partsupp WHERE ps_availqty > 60 UNION ALL SELECT ps_suppkey FROM partsupp WHERE ps_supplycost < 8) AS subq_10 ON supplier.s_suppkey = subq_10.ps_suppkey) AND o.o_orderkey = l.l_orderkey AND o.o_custkey = c.c_custkey AND o.o_orderkey > 4733543 AND l.l_shipmode LIKE 'MAIL%' AND p.p_mfgr LIKE 'Manufacturer#1%' AND o.o_orderpriority LIKE '3-MEDIUM%' AND p.p_retailprice >= 1868.9073633293574 AND c.c_custkey > 43197 AND p.p_size <= 13 AND o.o_orderdate <= '1993-10-14' AND c.c_mktsegment LIKE 'AUTOMOBILE%' AND c.c_nationkey = 22  GROUP BY c.c_acctbal LIMIT 30;"
