,db_id,original_sql
19,tpch,"SELECT o.o_orderstatus AS o_o_orderstatus, SUM(l.l_tax) AS sum_l_l_tax, MIN(p.p_size) AS min_p_p_size, MAX(ps.ps_suppkey) AS max_ps_ps_suppkey, SUM(l.l_orderkey) AS sum_l_l_orderkey FROM lineitem l, orders o, part p, partsupp ps WHERE o.o_totalprice IN (SELECT DISTINCT o_totalprice FROM orders UNION SELECT l_extendedprice FROM lineitem UNION SELECT l_extendedprice FROM (SELECT DISTINCT l_extendedprice FROM lineitem AS l1_1 WHERE l_shipdate > '1995-01-01') AS subq_1) AND p.p_retailprice > (SELECT COUNT(DISTINCT l_orderkey) FROM lineitem WHERE l_partkey IN (SELECT p_partkey FROM part WHERE p_type LIKE 'MEDIUM%') AND l_suppkey IN (SELECT s_suppkey FROM supplier WHERE s_acctbal > 5000) AND l_quantity > 20) AND l.l_tax = (SELECT COUNT(DISTINCT r_regionkey) FROM region WHERE r_name = 'EUROPE' AND (r_regionkey = 1 OR r_regionkey = 2) AND 9+9=18 AND r_regionkey IN (SELECT n_regionkey FROM nation WHERE n_name = 'GERMANY' AND 10*11=110)) AND EXISTS (SELECT MAX(c_acctbal) FROM (SELECT c_acctbal, c_mktsegment FROM customer WHERE c_nationkey BETWEEN 10 AND 20 ) t GROUP BY c_mktsegment ORDER BY c_mktsegment) AND ps.ps_supplycost = (SELECT COUNT(DISTINCT o_orderkey) FROM orders JOIN (SELECT c_custkey FROM customer WHERE c_mktsegment = 'HOUSEHOLD' UNION ALL SELECT c_custkey FROM customer WHERE c_acctbal > 2000) AS cust_union_5 ON orders.o_custkey = cust_union_5.c_custkey) AND ps.ps_suppkey = (SELECT COUNT(DISTINCT n_nationkey) FROM nation JOIN (SELECT c_nationkey FROM customer WHERE c_acctbal > 5000 UNION ALL SELECT c_nationkey FROM customer WHERE c_mktsegment = 'AUTOMOBILE') AS subq_6 ON nation.n_nationkey = subq_6.c_nationkey) AND l.l_quantity = (SELECT COUNT(*) FROM (SELECT c_custkey FROM customer WHERE c_nationkey IN (SELECT n_nationkey FROM nation WHERE n_regionkey = 1) UNION ALL SELECT o_custkey FROM orders WHERE o_totalprice > 1000) t) AND EXISTS (SELECT AVG(ps_supplycost) FROM (SELECT ps_supplycost, s_name FROM partsupp JOIN supplier ON ps_suppkey = s_suppkey WHERE ps_availqty > 50 ) AS t_8 GROUP BY s_name ORDER BY s_name) AND EXISTS (SELECT MIN(p_retailprice) FROM (SELECT p_retailprice, p_brand FROM part WHERE p_size > 15 UNION ALL SELECT p_retailprice, p_brand FROM part WHERE p_size <= 15 GROUP BY p_retailprice, p_brand) p JOIN (SELECT s_suppkey, s_name FROM supplier) s ON p.p_retailprice = s.s_suppkey GROUP BY s.s_name) AND l.l_suppkey = (SELECT COUNT(*) FROM (SELECT c_address FROM customer UNION ALL SELECT s_address FROM supplier ) t) AND o.o_orderkey = l.l_orderkey AND p.p_partkey = ps.ps_partkey AND ps.ps_partkey = l.l_partkey AND ps.ps_suppkey = l.l_suppkey AND l.l_shipinstruct LIKE 'COLLECT COD%' AND l.l_partkey > 144416 AND p.p_name LIKE 'medium dodger forest papaya peach%' AND ps.ps_availqty <= 9449 AND p.p_retailprice = 1841.3478794189587 AND l.l_quantity >= 39.082017858326495 AND ps.ps_suppkey >= 3052 AND l.l_commitdate > '1995-09-20' AND p.p_brand LIKE 'Brand#51%' AND l.l_shipmode LIKE 'REG AIR%'  GROUP BY o.o_orderstatus LIMIT 10;"
20,tpch,"SELECT MAX(p.p_type) AS max_p_p_type, MAX(l.l_shipinstruct) AS max_l_l_shipinstruct, COUNT(s.s_comment) AS count_s_s_comment, MAX(p.p_retailprice) AS max_p_p_retailprice, l.l_comment AS l_l_comment FROM customer c, lineitem l, nation n, part p, supplier s WHERE s.s_nationkey = (SELECT COUNT(DISTINCT p_partkey) FROM part JOIN (SELECT ps_partkey FROM partsupp WHERE ps_supplycost < 30 UNION ALL SELECT ps_partkey FROM partsupp WHERE ps_availqty > 200) AS partsupp_union_1 ON part.p_partkey = partsupp_union_1.ps_partkey) AND l.l_extendedprice > (SELECT (20 * 5) + COUNT(DISTINCT l_linenumber) FROM lineitem WHERE l_extendedprice IN (SELECT p_retailprice FROM part WHERE p_size < 15)) AND p.p_retailprice = (SELECT COUNT(*) FROM (SELECT p_brand FROM part UNION ALL SELECT n_name FROM nation ) t) AND EXISTS (SELECT DISTINCT p_container FROM part UNION SELECT p_type FROM part WHERE p_size < 15) AND EXISTS (SELECT AVG(p_retailprice) FROM (SELECT p_retailprice, p_type FROM part JOIN supplier ON p_partkey = s_suppkey WHERE s_nationkey = 1 UNION SELECT p_retailprice, p_type FROM part JOIN lineitem ON p_partkey = l_partkey WHERE l_discount > 0.05 AND l_shipdate IN (SELECT l_shipdate FROM lineitem WHERE l_commitdate > '1996-01-01')) AS subq_5 GROUP BY p_type) AND EXISTS (SELECT p_name FROM part WHERE p_partkey IN (SELECT ps_partkey FROM partsupp WHERE ps_supplycost < 30 UNION SELECT p_partkey FROM part WHERE p_size > 15)) AND EXISTS (SELECT c_phone FROM (SELECT c_phone, c_mktsegment FROM customer ) AS subq_7 UNION SELECT p_type FROM part) AND n.n_regionkey = (SELECT COUNT(DISTINCT n_nationkey) FROM (SELECT n_nationkey, n_comment FROM nation WHERE n_regionkey > 2 ) t) AND c.c_name IN (SELECT DISTINCT c_name FROM (SELECT c_name FROM customer UNION ALL SELECT n_name FROM nation) AS u_9 JOIN orders ON u_9.c_name = o_orderstatus) AND n.n_nationkey > (SELECT COUNT(DISTINCT o_orderkey) FROM orders WHERE o_custkey IN (SELECT c_custkey FROM customer WHERE c_acctbal < 500 INTERSECT SELECT c_custkey FROM customer WHERE c_mktsegment = 'BUILDING')) AND n.n_nationkey = s.s_nationkey AND n.n_nationkey = c.c_nationkey AND l.l_shipinstruct LIKE 'DELIVER IN PERSON%' AND p.p_type LIKE 'MEDIUM POLISHED STEEL%' AND c.c_custkey >= 13333 AND l.l_partkey > 67512 AND p.p_size < 29 AND c.c_name LIKE 'Customer#000005945%' AND p.p_retailprice > 1822.1366837808027 AND l.l_shipmode LIKE 'RAIL%' AND l.l_orderkey > 1915092 AND s.s_acctbal = 1486.256618209435  GROUP BY l.l_comment LIMIT 50;"
21,tpch,"SELECT COUNT(c.c_comment) AS count_c_c_comment, MIN(l.l_linenumber) AS min_l_l_linenumber, o.o_orderpriority AS o_o_orderpriority, p.p_type AS p_p_type, l.l_orderkey AS l_l_orderkey FROM customer c, lineitem l, orders o, part p WHERE p.p_mfgr IN (SELECT DISTINCT p_mfgr FROM part UNION SELECT p_brand FROM part WHERE p_retailprice < 50) AND EXISTS (SELECT o_2.o_clerk FROM orders o_2 WHERE o_2.o_orderkey IN (SELECT l_2.l_orderkey FROM lineitem l_2 WHERE l_2.l_discount > 0.05 UNION ALL SELECT l2_2.l_orderkey FROM lineitem l2_2 WHERE l2_2.l_shipdate < DATE '1995-06-01' GROUP BY l2_2.l_orderkey) AND o_2.o_totalprice < 5000) AND EXISTS (SELECT SUM(l_extendedprice) FROM (SELECT l_extendedprice, l_returnflag FROM lineitem WHERE l_shipdate < '1995-01-01' UNION ALL SELECT l_extendedprice, l_returnflag FROM lineitem WHERE l_shipdate >= '1995-01-01' GROUP BY l_extendedprice, l_returnflag) t JOIN (SELECT o_orderkey, o_orderstatus FROM orders) o ON t.l_extendedprice = o.o_orderkey GROUP BY o.o_orderstatus) AND EXISTS (SELECT DISTINCT c_name FROM (SELECT c_name FROM customer UNION ALL SELECT n_name FROM nation) AS u_4 JOIN orders ON u_4.c_name = o_orderstatus) AND c.c_nationkey > (SELECT COUNT(*) FROM (SELECT s_name FROM supplier UNION ALL SELECT p_name FROM part ) t) AND l.l_discount > (SELECT COUNT(*) FROM (SELECT p_name FROM part UNION ALL SELECT r_comment FROM region ) t) AND c.c_nationkey = (SELECT COUNT(*) FROM (SELECT c_comment FROM customer UNION ALL SELECT l_comment FROM lineitem ) t) AND p.p_brand IN (SELECT p_brand FROM part WHERE p_partkey IN (SELECT ps_partkey FROM partsupp WHERE ps_supplycost < 50 UNION SELECT p_partkey FROM part WHERE p_size < 10)) AND o.o_totalprice = (SELECT COUNT(DISTINCT l_partkey) FROM (SELECT l_partkey, l_extendedprice FROM lineitem WHERE l_discount < 0.1 AND l_tax > 0.05 ) t) AND c.c_nationkey = (SELECT COUNT(DISTINCT s_suppkey) FROM supplier WHERE s_nationkey IN (SELECT n_nationkey FROM nation WHERE n_regionkey = 3) AND s_acctbal < 3000 AND s_phone LIKE '27%') AND c.c_custkey = o.o_custkey AND o.o_orderkey = l.l_orderkey AND c.c_name LIKE 'Customer#000022020%' AND p.p_name LIKE 'white papaya dim chartreuse pink%' AND l.l_returnflag LIKE 'A%' AND o.o_orderstatus LIKE 'O%' AND l.l_linestatus LIKE 'O%' AND l.l_extendedprice >= 89668.8178317148 AND o.o_custkey <= 148073 AND p.p_brand LIKE 'Brand#54%' AND l.l_partkey = 99498 AND l.l_shipmode LIKE 'RAIL%'  GROUP BY l.l_orderkey, o.o_orderpriority, p.p_type LIMIT 50;"
22,tpch,"SELECT COUNT(c.c_acctbal) AS count_c_c_acctbal, COUNT(r.r_regionkey) AS count_r_r_regionkey, COUNT(p.p_brand) AS count_p_p_brand, COUNT(c.c_phone) AS count_c_c_phone, MIN(p.p_mfgr) AS min_p_p_mfgr FROM customer c, part p, region r WHERE EXISTS (SELECT r_name FROM region WHERE r_regionkey IN (SELECT n_regionkey FROM nation WHERE n_name LIKE 'A%' ) UNION SELECT r_name FROM region WHERE r_regionkey IN (SELECT n_regionkey FROM nation WHERE n_name NOT LIKE 'A%' ) ORDER BY r_name) AND EXISTS (SELECT COUNT(o_orderkey) FROM (SELECT o_orderkey, o_orderstatus FROM orders JOIN customer ON o_custkey = c_custkey WHERE o_totalprice < 5000 ) AS t_2 GROUP BY o_orderstatus ORDER BY o_orderstatus) AND EXISTS (SELECT DISTINCT o_totalprice FROM orders UNION SELECT l_extendedprice FROM lineitem UNION SELECT l_extendedprice FROM (SELECT DISTINCT l_extendedprice FROM lineitem AS l1_3 WHERE l_shipdate > '1995-01-01') AS subq_3) AND EXISTS (SELECT n_comment FROM (SELECT n_comment, n_nationkey FROM nation ) AS subq_4 UNION SELECT l_shipinstruct FROM lineitem) AND p.p_brand IN (SELECT p_brand FROM part WHERE p_partkey IN (SELECT ps_partkey FROM partsupp WHERE ps_supplycost > 150 ) UNION SELECT p_brand FROM part WHERE p_partkey IN (SELECT ps_partkey FROM partsupp WHERE ps_supplycost < 150 ) ORDER BY p_brand) AND c.c_custkey = (SELECT COUNT(DISTINCT p_container) FROM part JOIN (SELECT ps_partkey FROM partsupp UNION ALL SELECT ps_partkey FROM partsupp WHERE ps_supplycost > 20) AS partsupp_union_6 ON part.p_partkey = partsupp_union_6.ps_partkey) AND r.r_comment IN (SELECT DISTINCT r_comment FROM region UNION SELECT p_comment FROM part UNION SELECT p_comment FROM (SELECT DISTINCT p_comment FROM part AS p1_7 WHERE p_retailprice > 100) AS subq_7) AND EXISTS (SELECT MIN(l_tax) FROM (SELECT l_tax, l_shipinstruct FROM lineitem WHERE l_receiptdate BETWEEN DATE '1994-01-01' AND DATE '1994-12-31' ) t GROUP BY l_shipinstruct ORDER BY l_shipinstruct) AND EXISTS (SELECT l_linestatus FROM (SELECT l_linestatus, l_extendedprice FROM lineitem ) AS subq_9 UNION SELECT r_comment FROM region) AND EXISTS (SELECT SUM(l_extendedprice) FROM (SELECT l_extendedprice, l_returnflag FROM lineitem JOIN orders ON l_orderkey = o_orderkey ) AS t_10 GROUP BY l_returnflag ORDER BY l_returnflag) AND c.c_custkey > 130319 AND p.p_container LIKE 'LG BOX%' AND r.r_name LIKE 'AMERICA%' AND p.p_type LIKE 'ECONOMY PLATED NICKEL%' AND p.p_name LIKE 'khaki forest lime white coral%' AND p.p_size < 31 AND p.p_partkey <= 29232 AND p.p_retailprice <= 2040.229157141842 AND p.p_brand LIKE 'Brand#33%' AND c.c_acctbal >= 7715.103198322817  LIMIT 100;"
23,tpch,"SELECT MIN(ps.ps_availqty) AS min_ps_ps_availqty, COUNT(l.l_quantity) AS count_l_l_quantity, ps.ps_comment AS ps_ps_comment, MAX(p.p_partkey) AS max_p_p_partkey, c.c_phone AS c_c_phone FROM customer c, lineitem l, part p, partsupp ps, region r WHERE EXISTS (SELECT c_address FROM (SELECT c_address FROM customer WHERE c_custkey IN (SELECT o_custkey FROM orders WHERE o_orderdate < '1994-01-01' UNION SELECT o_custkey FROM orders WHERE o_totalprice < 5000) UNION ALL SELECT c_address FROM customer WHERE c_custkey IN (SELECT o_custkey FROM orders WHERE o_orderpriority = '5-LOW' UNION ALL SELECT o_custkey FROM orders WHERE o_orderstatus = 'P')) t GROUP BY c_address) AND l.l_partkey > (SELECT COUNT(DISTINCT l_linenumber) FROM (SELECT l_linenumber, l_discount FROM lineitem WHERE l_extendedprice > 1000 ) t) AND p.p_name IN (SELECT p_name FROM part WHERE p_partkey IN (SELECT ps_partkey FROM partsupp JOIN supplier ON ps_suppkey = s_suppkey WHERE s_acctbal < 2000 UNION SELECT ps_partkey FROM partsupp JOIN supplier ON ps_suppkey = s_suppkey WHERE s_acctbal > 5000 UNION SELECT ps_partkey FROM partsupp JOIN supplier ON ps_suppkey = s_suppkey WHERE s_acctbal < 1000)) AND EXISTS (SELECT SUM(l_extendedprice) FROM (SELECT l_extendedprice, l_returnflag FROM lineitem WHERE l_shipdate >= DATE '1994-01-01' ) t GROUP BY l_returnflag ORDER BY l_returnflag) AND l.l_suppkey > (SELECT COUNT(DISTINCT l_suppkey) FROM lineitem WHERE l_partkey IN (SELECT p_partkey FROM part WHERE p_type LIKE 'SMALL%') AND l_quantity < 15 AND l_shipdate > DATE '1995-09-01') AND l.l_partkey > (SELECT COUNT(DISTINCT o_orderpriority) FROM orders JOIN (SELECT c_custkey FROM customer UNION ALL SELECT c_custkey FROM customer WHERE c_mktsegment = 'AUTOMOBILE') AS cust_union_6 ON orders.o_custkey = cust_union_6.c_custkey) AND r.r_name IN (SELECT r_name FROM (SELECT r_name, r_regionkey FROM region WHERE r_regionkey = 2 ) AS subq_7 WHERE r_regionkey > 1 ORDER BY r_regionkey) AND c.c_custkey IN (SELECT DISTINCT c_custkey FROM customer UNION SELECT o_custkey FROM orders WHERE o_totalprice > 1000) AND ps.ps_suppkey > (SELECT COUNT(DISTINCT l_linenumber) FROM (SELECT l_linenumber FROM lineitem WHERE l_quantity > 20 UNION ALL SELECT o_shippriority FROM orders WHERE o_totalprice < 500) t JOIN part ON p_partkey = t.l_linenumber) AND EXISTS (SELECT ps_supplycost FROM (SELECT ps_supplycost, ps_partkey FROM partsupp WHERE ps_partkey = 7 ) AS subq_10 WHERE ps_partkey > 6 ORDER BY ps_partkey) AND ps.ps_partkey = l.l_partkey AND ps.ps_suppkey = l.l_suppkey AND ps.ps_partkey = p.p_partkey AND c.c_nationkey <= 8 AND l.l_returnflag LIKE 'A%' AND l.l_discount < 0.08767710703616097 AND p.p_retailprice > 1637.1994354309259 AND l.l_linenumber > 4 AND ps.ps_supplycost < 927.0348781674392 AND p.p_brand LIKE 'Brand#45%' AND l.l_shipinstruct LIKE 'TAKE BACK RETURN%' AND p.p_partkey = 81741 AND l.l_receiptdate >= '1992-03-20'  GROUP BY ps.ps_comment, c.c_phone LIMIT 10;"
24,tpch,"SELECT l.l_commitDATE AS l_l_commitDATE, MIN(n.n_name) AS min_n_n_name, MIN(p.p_name) AS min_p_p_name, AVG(ps.ps_supplycost) AS avg_ps_ps_supplycost, s.s_phone AS s_s_phone FROM customer c, lineitem l, nation n, part p, partsupp ps, supplier s WHERE s.s_suppkey > (SELECT COUNT(DISTINCT l_partkey) FROM (SELECT l_partkey, l_extendedprice FROM lineitem WHERE l_discount < 0.1 AND l_tax > 0.05 ) t) AND EXISTS (SELECT COUNT(*) FROM (SELECT c_address FROM customer UNION SELECT s_address FROM (SELECT s_address, COUNT(*) FROM supplier GROUP BY s_address HAVING COUNT(*) > 3) AS subq_2) AS t_2) AND s.s_nationkey > (SELECT COUNT(DISTINCT l_linenumber) FROM lineitem JOIN (SELECT o_orderkey FROM orders WHERE o_totalprice < 800 UNION ALL SELECT o_orderkey FROM orders WHERE o_orderdate < '1996-01-01') AS subq_3 ON lineitem.l_orderkey = subq_3.o_orderkey) AND c.c_custkey > (SELECT COUNT(DISTINCT o_custkey) FROM (SELECT o_custkey, o_totalprice FROM orders WHERE o_totalprice > 50000 ) t) AND p.p_partkey > (SELECT COUNT(*) FROM (SELECT c_custkey FROM customer WHERE c_nationkey IN (SELECT n_nationkey FROM nation WHERE n_regionkey = 2) UNION ALL SELECT o_custkey FROM orders WHERE o_totalprice > 1500) t) AND s.s_nationkey > (SELECT COUNT(DISTINCT o_custkey) FROM orders JOIN (SELECT c_custkey FROM customer UNION ALL SELECT c_custkey FROM customer WHERE c_acctbal > 1000) AS cust_union_6 ON orders.o_custkey = cust_union_6.c_custkey) AND l.l_extendedprice = (SELECT COUNT(DISTINCT ps_partkey) FROM partsupp WHERE ps_suppkey IN (SELECT s_suppkey FROM supplier WHERE s_acctbal > 7000 UNION SELECT s_suppkey FROM supplier WHERE s_nationkey = 2)) AND ps.ps_availqty = (SELECT COUNT(DISTINCT ps_partkey) FROM partsupp WHERE ps_suppkey IN (SELECT s_suppkey FROM supplier WHERE s_acctbal > 5000 UNION SELECT s_suppkey FROM supplier WHERE s_nationkey = 1)) AND EXISTS (SELECT AVG(l_extendedprice) FROM (SELECT l_extendedprice, l_shipmode FROM lineitem WHERE l_shipdate BETWEEN DATE '1997-01-01' AND DATE '1997-12-31' ) t GROUP BY l_shipmode ORDER BY l_shipmode) AND n.n_regionkey > (SELECT COUNT(DISTINCT s_suppkey) FROM supplier WHERE s_acctbal < 1500 AND (s_nationkey = 3 OR s_nationkey = 7) AND 2+3=5 AND s_nationkey IN (SELECT n_nationkey FROM nation WHERE n_regionkey = 4 AND 4*5=20)) AND ps.ps_suppkey = s.s_suppkey AND ps.ps_partkey = l.l_partkey AND ps.ps_suppkey = l.l_suppkey AND ps.ps_partkey = p.p_partkey AND n.n_nationkey = s.s_nationkey AND n.n_nationkey = c.c_nationkey AND c.c_name LIKE 'Customer#000023589%' AND s.s_acctbal > 4801.268361626979 AND p.p_name LIKE 'smoke magenta forest maroon ghost%' AND s.s_nationkey > 15 AND n.n_name LIKE 'IRAN%' AND l.l_suppkey = 8091 AND p.p_partkey <= 136558 AND l.l_linestatus LIKE 'F%' AND l.l_orderkey >= 1042470 AND l.l_returnflag LIKE 'A%'  GROUP BY l.l_commitDATE, s.s_phone LIMIT 10;"
25,tpch,"SELECT MIN(l.l_comment) AS min_l_l_comment, COUNT(l.l_orderkey) AS count_l_l_orderkey, MAX(l.l_shipDATE) AS max_l_l_shipDATE, COUNT(l.l_linenumber) AS count_l_l_linenumber, AVG(c.c_nationkey) AS avg_c_c_nationkey FROM customer c, lineitem l, partsupp ps WHERE c.c_acctbal > (SELECT COUNT(DISTINCT s_name) FROM (SELECT s_name FROM supplier WHERE s_acctbal > 8000 EXCEPT SELECT c_name FROM customer WHERE c_acctbal < 1500 ) AS subquery_1) AND ps.ps_supplycost IN (SELECT ps_supplycost FROM (SELECT ps_supplycost, ps_partkey FROM partsupp WHERE ps_partkey = 7 ) AS subq_2 WHERE ps_partkey > 6 ORDER BY ps_partkey) AND EXISTS (SELECT p_container FROM (SELECT p_container FROM part WHERE p_partkey IN (SELECT l_partkey FROM lineitem WHERE l_shipdate > '1996-01-01' ) UNION ALL SELECT p_container FROM part WHERE p_size > 20) t GROUP BY p_container ORDER BY p_container) AND c.c_acctbal = (SELECT COUNT(DISTINCT p_type) FROM part JOIN (SELECT ps_partkey FROM partsupp UNION ALL SELECT ps_partkey FROM partsupp WHERE ps_availqty > 100) AS partsupp_union_4 ON part.p_partkey = partsupp_union_4.ps_partkey) AND EXISTS (SELECT c_name FROM customer WHERE c_custkey IN (SELECT o_custkey FROM orders JOIN lineitem ON o_orderkey = l_orderkey WHERE l_discount > 0.05 UNION SELECT o_custkey FROM orders JOIN lineitem ON o_orderkey = l_orderkey WHERE l_discount < 0.10 UNION SELECT o_custkey FROM orders JOIN lineitem ON o_orderkey = l_orderkey WHERE l_discount > 0.15)) AND EXISTS (SELECT l_shipmode FROM (SELECT l_shipmode, l_quantity FROM lineitem ) AS subq_6 UNION SELECT c_phone FROM customer) AND EXISTS (SELECT p_mfgr FROM (SELECT p_mfgr FROM part WHERE p_partkey IN (SELECT l_partkey FROM lineitem WHERE l_shipdate > '1997-06-30' UNION SELECT l_partkey FROM lineitem WHERE l_discount < 0.05) UNION ALL SELECT p_mfgr FROM part WHERE p_partkey IN (SELECT l_partkey FROM lineitem WHERE l_returnflag = 'Y' UNION ALL SELECT l_partkey FROM lineitem WHERE l_linestatus = 'F')) t GROUP BY p_mfgr) AND l.l_orderkey > (SELECT COUNT(DISTINCT o_orderkey) FROM orders JOIN (SELECT c_custkey FROM customer WHERE c_mktsegment = 'MACHINERY' UNION ALL SELECT c_custkey FROM customer WHERE c_acctbal > 1500) AS cust_union_8 ON orders.o_custkey = cust_union_8.c_custkey) AND EXISTS (SELECT COUNT(*) FROM (SELECT c_nationkey FROM customer UNION SELECT s_nationkey FROM (SELECT s_nationkey, COUNT(*) FROM supplier GROUP BY s_nationkey HAVING COUNT(*) > 4) AS subq_9) AS t_9) AND EXISTS (SELECT p_name FROM (SELECT p_name FROM part WHERE p_partkey IN (SELECT l_partkey FROM lineitem WHERE l_shipdate < '1998-12-31' UNION SELECT l_partkey FROM lineitem WHERE l_quantity > 50) UNION ALL SELECT p_name FROM part WHERE p_partkey IN (SELECT l_partkey FROM lineitem WHERE l_returnflag = 'N' UNION ALL SELECT l_partkey FROM lineitem WHERE l_linestatus = 'O')) t GROUP BY p_name) AND l.l_partkey = ps.ps_partkey AND l.l_suppkey = ps.ps_suppkey AND l.l_tax < 0.008820000365177548 AND l.l_suppkey = 4095 AND l.l_commitdate <= '1997-05-14' AND l.l_shipmode LIKE 'REG AIR%' AND l.l_shipinstruct LIKE 'TAKE BACK RETURN%' AND ps.ps_availqty <= 3778 AND c.c_custkey < 86733 AND ps.ps_partkey >= 73145 AND l.l_linestatus LIKE 'O%' AND ps.ps_suppkey > 625  LIMIT 10;"
26,tpch,"SELECT MIN(l.l_linenumber) AS min_l_l_linenumber, MAX(r.r_regionkey) AS max_r_r_regionkey, COUNT(l.l_partkey) AS count_l_l_partkey, l.l_suppkey AS l_l_suppkey, MAX(l.l_partkey) AS max_l_l_partkey FROM lineitem l, region r WHERE EXISTS (SELECT o_orderpriority FROM (SELECT o_orderpriority, o_clerk FROM orders ) AS subq_1 UNION SELECT p_container FROM part) AND EXISTS (SELECT l_returnflag FROM (SELECT l_returnflag FROM lineitem WHERE l_orderkey IN (SELECT o_orderkey FROM orders WHERE o_orderdate > '1996-12-31' ) UNION ALL SELECT l_returnflag FROM lineitem WHERE l_discount > 0.05) t GROUP BY l_returnflag ORDER BY l_returnflag) AND EXISTS (SELECT DISTINCT c_name FROM customer UNION SELECT c_comment FROM customer WHERE c_acctbal < 2000) AND EXISTS (SELECT MAX(p_retailprice) FROM (SELECT p_retailprice, p_brand FROM part JOIN partsupp ON p_partkey = ps_partkey ) AS t_4 GROUP BY p_brand ORDER BY p_brand) AND l.l_orderkey = (SELECT COUNT(DISTINCT o_orderkey) FROM orders WHERE o_custkey IN (SELECT c_custkey FROM customer WHERE c_acctbal < 800 INTERSECT SELECT c_custkey FROM customer WHERE c_mktsegment = 'HOUSEHOLD')) AND EXISTS (SELECT MIN(p_retailprice) FROM (SELECT p_retailprice, p_brand FROM part WHERE p_size > 10 ) t GROUP BY p_brand ORDER BY p_brand) AND l.l_quantity > (SELECT COUNT(DISTINCT r_regionkey) FROM region WHERE r_name = 'ASIA' AND (r_regionkey = 1 OR r_regionkey = 2) AND r_comment LIKE 'B%') AND EXISTS (SELECT o_totalprice FROM (SELECT o_totalprice, o_custkey FROM orders WHERE o_custkey = 10 ) AS subq_8 WHERE o_custkey > 9 ORDER BY o_custkey) AND EXISTS (SELECT c_9.c_name FROM customer c_9 WHERE c_9.c_custkey IN (SELECT o_9.o_custkey FROM orders o_9 WHERE o_9.o_totalprice > 1000 UNION ALL SELECT o2_9.o_custkey FROM orders o2_9 WHERE o2_9.o_orderdate > DATE '1995-01-01' GROUP BY o2_9.o_custkey) AND c_9.c_acctbal < 0) AND r.r_comment IN (SELECT r_comment FROM region WHERE r_regionkey IN (SELECT n_regionkey FROM nation WHERE n_name LIKE 'E%' ) UNION SELECT r_comment FROM region WHERE r_regionkey IN (SELECT n_regionkey FROM nation WHERE n_name NOT LIKE 'E%' ) ORDER BY r_comment) AND l.l_suppkey <= 32 AND l.l_extendedprice > 75939.06455843349 AND l.l_shipdate > '1992-11-04' AND l.l_linestatus LIKE 'F%' AND l.l_quantity < 6.732392321646494 AND l.l_tax <= 0.004266971005882798 AND l.l_returnflag LIKE 'N%' AND l.l_shipmode LIKE 'REG AIR%' AND r.r_regionkey >= 1 AND l.l_discount > 0.0751177373579332  GROUP BY l.l_suppkey LIMIT 100;"
27,tpch,"SELECT COUNT(c.c_custkey) AS count_c_c_custkey, MAX(l.l_partkey) AS max_l_l_partkey, SUM(l.l_quantity) AS sum_l_l_quantity, MIN(l.l_extendedprice) AS min_l_l_extendedprice, MIN(l.l_receiptDATE) AS min_l_l_receiptDATE FROM customer c, lineitem l WHERE c.c_acctbal > (SELECT COUNT(*) FROM (SELECT o_clerk FROM orders UNION ALL SELECT p_mfgr FROM part ) t) AND l.l_linenumber = (SELECT COUNT(*) FROM (SELECT c_nationkey FROM customer UNION ALL SELECT n_regionkey FROM nation ) t) AND EXISTS (SELECT p_mfgr FROM (SELECT p_mfgr FROM part WHERE p_partkey IN (SELECT ps_partkey FROM partsupp WHERE ps_availqty < 30 ) UNION ALL SELECT p_mfgr FROM part WHERE p_retailprice < 50) t GROUP BY p_mfgr ORDER BY p_mfgr) AND EXISTS (SELECT SUM(l_extendedprice) FROM (SELECT l_extendedprice, l_returnflag FROM lineitem WHERE l_shipdate >= DATE '1994-01-01' ) t GROUP BY l_returnflag ORDER BY l_returnflag) AND EXISTS (SELECT DISTINCT o_totalprice FROM orders UNION SELECT DISTINCT s_acctbal FROM supplier WHERE s_nationkey = 4 UNION SELECT DISTINCT l_extendedprice FROM lineitem WHERE l_discount > 0.15) AND EXISTS (SELECT c_address FROM (SELECT c_address, c_mktsegment FROM customer WHERE c_mktsegment = 'AUTOMOBILE' ) AS subq_6 WHERE c_mktsegment != 'BUILDING' ORDER BY c_mktsegment) AND EXISTS (SELECT DISTINCT o_orderstatus FROM orders UNION SELECT DISTINCT s_name FROM supplier WHERE s_acctbal < 3000 UNION SELECT DISTINCT l_linestatus FROM lineitem WHERE l_extendedprice > 50) AND l.l_discount = (SELECT COUNT(DISTINCT c_custkey) FROM customer WHERE c_acctbal < 3000 AND (c_mktsegment = 'FURNITURE' OR c_mktsegment = 'HOUSEHOLD') AND c_phone LIKE '30%') AND EXISTS (SELECT AVG(p_size) FROM (SELECT p_size, p_mfgr FROM part WHERE p_retailprice > 50 ) t GROUP BY p_mfgr ORDER BY p_mfgr) AND EXISTS (SELECT p_10.p_name FROM part p_10 WHERE p_10.p_partkey IN (SELECT ps_10.ps_partkey FROM partsupp ps_10 WHERE ps_10.ps_supplycost < 60 UNION ALL SELECT ps2_10.ps_partkey FROM partsupp ps2_10 WHERE ps2_10.ps_availqty > 200 GROUP BY ps2_10.ps_partkey) AND p_10.p_retailprice > 150) AND l.l_quantity <= 34.58955006992364 AND l.l_shipinstruct LIKE 'TAKE BACK RETURN%' AND l.l_tax = 0.05057108828343553 AND l.l_extendedprice < 75907.00857304869 AND l.l_partkey <= 136142 AND c.c_nationkey > 11 AND l.l_linestatus LIKE 'F%' AND l.l_commitdate < '1997-02-07' AND l.l_receiptdate >= '1996-04-16' AND l.l_linenumber <= 4  LIMIT 100;"
