,db_id,original_sql
10,tpch,"SELECT COUNT(s.s_address) AS count_s_s_address, c.c_address AS c_c_address, MAX(l.l_comment) AS max_l_l_comment, COUNT(l.l_commitDATE) AS count_l_l_commitDATE, o.o_clerk AS o_o_clerk FROM customer c, lineitem l, orders o, part p, supplier s WHERE EXISTS (SELECT MAX(o_totalprice) FROM (SELECT o_totalprice, o_orderpriority FROM orders WHERE o_orderdate <= DATE '1996-12-31' ) t GROUP BY o_orderpriority ORDER BY o_orderpriority) AND o.o_orderstatus IN (SELECT o_orderstatus FROM (SELECT o_orderstatus, o_totalprice FROM orders WHERE o_totalprice = 5000 ) AS subq_2 WHERE o_totalprice > 3000 ORDER BY o_totalprice) AND EXISTS (SELECT DISTINCT n_name FROM nation UNION SELECT c_name FROM customer UNION SELECT c_name FROM (SELECT DISTINCT c_name FROM customer AS c1_3 WHERE c_acctbal < 2000) AS subq_3) AND EXISTS (SELECT AVG(p_retailprice) FROM (SELECT p_retailprice, p_type FROM part JOIN partsupp ON p_partkey = ps_partkey WHERE p_size > 10 ) AS t_4 GROUP BY p_type ORDER BY p_type) AND c.c_nationkey > (SELECT COUNT(DISTINCT l_suppkey) FROM (SELECT l_suppkey FROM lineitem WHERE l_discount > 0.05 UNION ALL SELECT ps_suppkey FROM partsupp WHERE ps_supplycost > 60) t JOIN part ON p_partkey = t.l_suppkey) AND EXISTS (SELECT p_brand FROM (SELECT p_brand FROM part WHERE p_partkey IN (SELECT ps_partkey FROM partsupp WHERE ps_supplycost < 8 ) UNION ALL SELECT p_brand FROM part WHERE p_size > 15) t GROUP BY p_brand ORDER BY p_brand) AND s.s_nationkey = (SELECT COUNT(DISTINCT n_nationkey) FROM nation JOIN (SELECT c_nationkey FROM customer WHERE c_acctbal > 5000 UNION ALL SELECT c_nationkey FROM customer WHERE c_mktsegment = 'AUTOMOBILE') AS subq_7 ON nation.n_nationkey = subq_7.c_nationkey) AND l.l_discount > (SELECT COUNT(DISTINCT s_suppkey) FROM supplier WHERE s_acctbal > 1000 AND (s_nationkey = 5 OR s_nationkey = 10) AND 4+4=8 AND s_nationkey IN (SELECT n_nationkey FROM nation WHERE n_regionkey = 1 AND 5*6=30)) AND p.p_brand IN (SELECT DISTINCT p_brand FROM part UNION SELECT c_phone FROM customer UNION SELECT c_phone FROM (SELECT DISTINCT c_phone FROM customer AS c1_9 WHERE c_acctbal < 1500) AS subq_9) AND p.p_container IN (SELECT p_container FROM part WHERE p_partkey IN (SELECT l_partkey FROM lineitem WHERE l_discount > 0.05 ) UNION SELECT p_container FROM part WHERE p_partkey IN (SELECT l_partkey FROM lineitem WHERE l_discount < 0.05 ) ORDER BY p_container) AND o.o_orderkey = l.l_orderkey AND o.o_custkey = c.c_custkey AND o.o_orderpriority LIKE '1-URGENT%' AND c.c_nationkey >= 10 AND l.l_returnflag LIKE 'A%' AND l.l_discount = 0.0705365704009939 AND s.s_acctbal > 1829.136879787007 AND l.l_shipmode LIKE 'REG AIR%' AND l.l_extendedprice >= 9171.24742641187 AND o.o_custkey >= 104295 AND l.l_quantity >= 38.23899458207405 AND s.s_nationkey > 12  GROUP BY o.o_clerk, c.c_address LIMIT 100;"
11,tpch,"SELECT l.l_shipinstruct AS l_l_shipinstruct, MAX(l.l_returnflag) AS max_l_l_returnflag, c.c_mktsegment AS c_c_mktsegment, SUM(c.c_acctbal) AS sum_c_c_acctbal, AVG(c.c_nationkey) AS avg_c_c_nationkey FROM customer c, lineitem l WHERE l.l_discount = (SELECT COUNT(DISTINCT l_linenumber) FROM lineitem JOIN (SELECT o_orderkey FROM orders UNION ALL SELECT o_orderkey FROM orders WHERE o_orderdate > '1995-01-01') AS order_union_1 ON lineitem.l_orderkey = order_union_1.o_orderkey) AND EXISTS (SELECT p_name FROM (SELECT p_name FROM part WHERE p_partkey IN (SELECT l_partkey FROM lineitem WHERE l_shipdate < '1995-01-01' ) UNION ALL SELECT p_name FROM part WHERE p_retailprice > 100) t GROUP BY p_name ORDER BY p_name) AND c.c_comment IN (SELECT DISTINCT c_comment FROM customer UNION SELECT l_comment FROM lineitem UNION SELECT l_comment FROM (SELECT DISTINCT l_comment FROM lineitem AS l1_3 WHERE l_tax < 0.05) AS subq_3) AND EXISTS (SELECT COUNT(o_orderkey) FROM (SELECT o_orderkey, o_orderstatus FROM orders JOIN customer ON o_custkey = c_custkey WHERE o_totalprice < 5000 ) AS t_4 GROUP BY o_orderstatus ORDER BY o_orderstatus) AND EXISTS (SELECT DISTINCT o_orderstatus FROM orders UNION SELECT DISTINCT s_name FROM supplier WHERE s_acctbal < 3000 UNION SELECT DISTINCT l_linestatus FROM lineitem WHERE l_extendedprice > 50) AND EXISTS (SELECT o_orderpriority FROM (SELECT o_orderpriority FROM orders WHERE o_orderkey IN (SELECT l_orderkey FROM lineitem WHERE l_commitdate < '1995-03-15' ) UNION ALL SELECT o_orderpriority FROM orders WHERE o_totalprice > 1000) t GROUP BY o_orderpriority ORDER BY o_orderpriority) AND c.c_name IN (SELECT c_name FROM customer WHERE c_custkey IN (SELECT o_custkey FROM orders JOIN lineitem ON o_orderkey = l_orderkey WHERE l_discount > 0.05 UNION SELECT o_custkey FROM orders JOIN lineitem ON o_orderkey = l_orderkey WHERE l_discount < 0.10 UNION SELECT o_custkey FROM orders JOIN lineitem ON o_orderkey = l_orderkey WHERE l_discount > 0.15)) AND l.l_partkey > (SELECT COUNT(DISTINCT c_custkey) FROM (SELECT c_custkey, c_address FROM customer WHERE c_acctbal < 1000 ) t) AND EXISTS (SELECT MAX(s_acctbal) FROM (SELECT s_acctbal, s_nationkey FROM supplier WHERE s_nationkey BETWEEN 1 AND 5 ) t GROUP BY s_nationkey ORDER BY s_nationkey) AND EXISTS (SELECT c_name FROM customer WHERE c_custkey IN (SELECT o_custkey FROM orders WHERE o_orderdate > '1995-01-01' UNION SELECT o_custkey FROM orders WHERE o_orderpriority = '1-URGENT')) AND l.l_commitdate < '1993-01-10' AND l.l_discount <= 0.01420771362614316 AND l.l_orderkey >= 1733965 AND l.l_quantity > 21.3368252996764 AND l.l_shipmode LIKE 'RAIL%' AND c.c_mktsegment LIKE 'AUTOMOBILE%' AND l.l_returnflag LIKE 'A%' AND l.l_partkey = 27394 AND c.c_name LIKE 'Customer#000003538%' AND l.l_tax >= 0.020229561967774777  GROUP BY l.l_shipinstruct, c.c_mktsegment LIMIT 30;"
12,tpch,"SELECT AVG(o.o_totalprice) AS avg_o_o_totalprice, SUM(o.o_custkey) AS sum_o_o_custkey, COUNT(o.o_orderDATE) AS count_o_o_orderDATE, SUM(p.p_partkey) AS sum_p_p_partkey, COUNT(l.l_partkey) AS count_l_l_partkey FROM customer c, lineitem l, orders o, part p WHERE l.l_partkey = (SELECT COUNT(*) FROM (SELECT o_totalprice FROM orders UNION ALL SELECT l_extendedprice FROM lineitem ) t) AND c.c_nationkey > (SELECT COUNT(DISTINCT l_linenumber) FROM (SELECT l_linenumber, l_discount FROM lineitem WHERE l_extendedprice > 1000 ) t) AND c.c_nationkey > (SELECT COUNT(DISTINCT l_partkey) FROM (SELECT l_partkey, l_extendedprice FROM lineitem WHERE l_discount < 0.1 AND l_tax > 0.05 ) t) AND o.o_totalprice > (SELECT COUNT(*) FROM (SELECT o_orderstatus FROM orders UNION ALL SELECT l_returnflag FROM lineitem ) t) AND o.o_custkey > (SELECT COUNT(DISTINCT s_suppkey) FROM supplier WHERE s_nationkey IN (SELECT n_nationkey FROM nation WHERE n_regionkey = 1) AND s_acctbal > 4000 AND s_phone LIKE '18%') AND l.l_linestatus IN (SELECT l_linestatus FROM (SELECT l_linestatus, l_extendedprice FROM lineitem ) AS subq_6 UNION SELECT r_comment FROM region) AND EXISTS (SELECT p_name FROM part WHERE p_partkey IN (SELECT ps_partkey FROM partsupp JOIN supplier ON ps_suppkey = s_suppkey WHERE s_acctbal > 3000 UNION SELECT ps_partkey FROM partsupp JOIN supplier ON ps_suppkey = s_suppkey WHERE s_acctbal < 1000 UNION SELECT ps_partkey FROM partsupp JOIN supplier ON ps_suppkey = s_suppkey WHERE s_acctbal > 5000)) AND p.p_name IN (SELECT p_name FROM part WHERE p_partkey IN (SELECT l_partkey FROM lineitem WHERE l_shipdate > '1995-06-30' UNION SELECT p_partkey FROM part WHERE p_retailprice < 150) AND p_size IN (SELECT p_size FROM part JOIN partsupp ON p_partkey = ps_partkey WHERE ps_availqty < 50)) AND o.o_custkey > (SELECT COUNT(DISTINCT o_orderpriority) FROM orders JOIN (SELECT c_custkey FROM customer UNION ALL SELECT c_custkey FROM customer WHERE c_mktsegment = 'AUTOMOBILE') AS cust_union_9 ON orders.o_custkey = cust_union_9.c_custkey) AND EXISTS (SELECT n_name FROM nation WHERE n_nationkey IN (SELECT c_nationkey FROM customer WHERE c_acctbal > 5000 ) UNION SELECT n_name FROM nation WHERE n_nationkey IN (SELECT c_nationkey FROM customer WHERE c_acctbal < 5000 ) ORDER BY n_name) AND c.c_custkey = o.o_custkey AND l.l_orderkey = o.o_orderkey AND o.o_orderkey <= 4666607 AND p.p_name LIKE 'thistle steel sky light red%' AND l.l_suppkey < 2121 AND c.c_acctbal >= 1554.2421170208916 AND p.p_partkey = 63312 AND c.c_custkey > 23283 AND l.l_partkey < 147868 AND l.l_shipinstruct LIKE 'DELIVER IN PERSON%' AND l.l_discount <= 0.04422569269186222 AND c.c_name LIKE 'Customer#000023589%'  LIMIT 30;"
13,tpch,"SELECT n.n_name AS n_n_name, p.p_retailprice AS p_p_retailprice, MIN(p.p_name) AS min_p_p_name, MAX(p.p_type) AS max_p_p_type, MIN(n.n_comment) AS min_n_n_comment FROM nation n, part p, region r WHERE p.p_name IN (SELECT p_name FROM (SELECT p_name, p_retailprice FROM part ) AS subq_1 UNION SELECT n_name FROM nation) AND EXISTS (SELECT AVG(p_size) FROM (SELECT p_size, p_mfgr FROM part WHERE p_retailprice > 50 ) t GROUP BY p_mfgr ORDER BY p_mfgr) AND n.n_name IN (SELECT DISTINCT n_name FROM nation UNION SELECT c_name FROM customer UNION SELECT c_name FROM (SELECT DISTINCT c_name FROM customer AS c1_3 WHERE c_acctbal < 2000) AS subq_3) AND r.r_regionkey = (SELECT COUNT(*) FROM (SELECT r_name FROM region UNION ALL SELECT n_name FROM nation ) t) AND EXISTS (SELECT DISTINCT c_address FROM customer UNION SELECT DISTINCT n_comment FROM nation WHERE n_regionkey = 3 UNION SELECT DISTINCT p_mfgr FROM part WHERE p_size < 8) AND EXISTS (SELECT p_container FROM (SELECT p_container FROM part WHERE p_partkey IN (SELECT l_partkey FROM lineitem WHERE l_shipdate BETWEEN '1995-01-01' AND '1995-12-31' UNION SELECT l_partkey FROM lineitem WHERE l_tax > 0.05) UNION ALL SELECT p_container FROM part WHERE p_partkey IN (SELECT l_partkey FROM lineitem WHERE l_returnflag = 'R' UNION ALL SELECT l_partkey FROM lineitem WHERE l_shipmode = 'AIR')) t GROUP BY p_container) AND n.n_regionkey > (SELECT COUNT(DISTINCT o_orderkey) FROM orders WHERE o_custkey IN (SELECT c_custkey FROM customer WHERE c_acctbal < 800 INTERSECT SELECT c_custkey FROM customer WHERE c_mktsegment = 'HOUSEHOLD')) AND n.n_nationkey > (SELECT COUNT(DISTINCT ps_partkey) FROM partsupp JOIN (SELECT p_partkey FROM part UNION ALL SELECT p_partkey FROM part WHERE p_retailprice > 50) AS part_union_8 ON partsupp.ps_partkey = part_union_8.p_partkey) AND EXISTS (SELECT AVG(p_retailprice) FROM (SELECT p_retailprice, p_type FROM part JOIN partsupp ON p_partkey = ps_partkey WHERE p_size > 10 ) AS t_9 GROUP BY p_type ORDER BY p_type) AND EXISTS (SELECT DISTINCT p_type FROM part UNION SELECT s_address FROM supplier UNION SELECT s_address FROM (SELECT DISTINCT s_address FROM supplier AS s1_10 WHERE s_nationkey = 2) AS subq_10) AND n.n_regionkey = r.r_regionkey AND r.r_regionkey > 1 AND n.n_regionkey = 3 AND p.p_name LIKE 'lace bisque drab plum maroon%' AND p.p_size >= 42 AND p.p_type LIKE 'SMALL POLISHED TIN%' AND p.p_partkey <= 76625 AND n.n_nationkey < 15 AND p.p_container LIKE 'MED BAG%' AND n.n_name LIKE 'FRANCE%' AND r.r_name LIKE 'AFRICA%'  GROUP BY n.n_name, p.p_retailprice LIMIT 10;"
14,tpch,"SELECT MAX(p.p_size) AS max_p_p_size, MIN(l.l_tax) AS min_l_l_tax, COUNT(s.s_suppkey) AS count_s_s_suppkey, COUNT(l.l_discount) AS count_l_l_discount, MAX(ps.ps_suppkey) AS max_ps_ps_suppkey FROM lineitem l, part p, partsupp ps, supplier s WHERE EXISTS (SELECT c_comment FROM customer WHERE c_custkey IN (SELECT o_custkey FROM orders WHERE o_orderdate > '1996-01-01' UNION SELECT o_custkey FROM orders WHERE o_orderpriority = '4-NOT SPECIFIED')) AND EXISTS (SELECT AVG(l_quantity) FROM (SELECT l_quantity, l_shipinstruct FROM lineitem WHERE l_shipdate BETWEEN DATE '1993-01-01' AND DATE '1993-06-30' ) t GROUP BY l_shipinstruct ORDER BY l_shipinstruct) AND ps.ps_partkey > (SELECT COUNT(DISTINCT r_regionkey) FROM (SELECT r_regionkey, r_comment FROM region WHERE r_regionkey > 1 ) t) AND EXISTS (SELECT r_4.r_comment FROM region r_4 WHERE r_4.r_regionkey IN (SELECT n_4.n_regionkey FROM nation n_4 WHERE n_4.n_name = 'CANADA' UNION ALL SELECT n2_4.n_regionkey FROM nation n2_4 WHERE n2_4.n_nationkey > 5 GROUP BY n2_4.n_regionkey) AND r_4.r_regionkey <> 2) AND l.l_linenumber = (SELECT COUNT(DISTINCT s_suppkey) FROM supplier WHERE s_acctbal > 1000 AND (s_nationkey = 5 OR s_nationkey = 10) AND 4+4=8 AND s_nationkey IN (SELECT n_nationkey FROM nation WHERE n_regionkey = 1 AND 5*6=30)) AND l.l_suppkey = (SELECT COUNT(DISTINCT o_orderkey) FROM orders JOIN (SELECT c_custkey FROM customer WHERE c_mktsegment = 'HOUSEHOLD' UNION ALL SELECT c_custkey FROM customer WHERE c_acctbal > 2000) AS cust_union_6 ON orders.o_custkey = cust_union_6.c_custkey) AND EXISTS (SELECT COUNT(*) FROM (SELECT s_suppkey FROM supplier UNION SELECT l_suppkey FROM (SELECT l_suppkey, COUNT(*) FROM lineitem GROUP BY l_suppkey HAVING COUNT(*) > 10) AS subq_7) AS t_7) AND s.s_name IN (SELECT DISTINCT s_name FROM supplier UNION SELECT s_comment FROM supplier WHERE s_acctbal < 3000) AND p.p_comment IN (SELECT DISTINCT p_comment FROM part UNION SELECT DISTINCT r_name FROM region WHERE r_regionkey = 4 UNION SELECT DISTINCT l_shipinstruct FROM lineitem WHERE l_quantity > 18) AND p.p_brand IN (SELECT DISTINCT p_brand FROM part UNION SELECT s_phone FROM supplier UNION SELECT s_phone FROM (SELECT DISTINCT s_phone FROM supplier AS s1_10 WHERE s_nationkey = 3) AS subq_10) AND s.s_suppkey = ps.ps_suppkey AND l.l_partkey = ps.ps_partkey AND l.l_suppkey = ps.ps_suppkey AND ps.ps_partkey = p.p_partkey AND l.l_linenumber = 1 AND p.p_partkey = 24168 AND ps.ps_suppkey >= 8829 AND s.s_acctbal >= 2639.9356947569013 AND p.p_size > 10 AND p.p_retailprice > 1108.5851148860795 AND l.l_receiptdate < '1993-01-06' AND p.p_brand LIKE 'Brand#12%' AND p.p_type LIKE 'SMALL BRUSHED NICKEL%' AND l.l_shipinstruct LIKE 'COLLECT COD%'  LIMIT 30;"
15,tpch,"SELECT MAX(p.p_partkey) AS max_p_p_partkey, COUNT(c.c_acctbal) AS count_c_c_acctbal, l.l_partkey AS l_l_partkey, c.c_custkey AS c_c_custkey, COUNT(p.p_size) AS count_p_p_size FROM customer c, lineitem l, nation n, part p WHERE p.p_brand IN (SELECT DISTINCT p_brand FROM part UNION SELECT s_phone FROM supplier UNION SELECT s_phone FROM (SELECT DISTINCT s_phone FROM supplier AS s1_1 WHERE s_nationkey = 3) AS subq_1) AND l.l_partkey = (SELECT COUNT(DISTINCT s_suppkey) FROM supplier WHERE s_nationkey IN (SELECT n_nationkey FROM nation WHERE n_regionkey = 3) AND s_acctbal < 3000 AND s_phone LIKE '27%') AND c.c_comment IN (SELECT c_comment FROM (SELECT c_comment, c_nationkey FROM customer WHERE c_nationkey = 5 ) AS subq_3 WHERE c_nationkey > 4 ORDER BY c_nationkey) AND EXISTS (SELECT s_phone FROM (SELECT s_phone, s_nationkey FROM supplier ) AS subq_4 UNION SELECT p_brand FROM part) AND n.n_nationkey > (SELECT COUNT(DISTINCT o_orderpriority) FROM orders JOIN (SELECT c_custkey FROM customer UNION ALL SELECT c_custkey FROM customer WHERE c_mktsegment = 'AUTOMOBILE') AS cust_union_5 ON orders.o_custkey = cust_union_5.c_custkey) AND EXISTS (SELECT n_name FROM nation WHERE n_nationkey IN (SELECT c_nationkey FROM customer WHERE c_acctbal > 1000 UNION SELECT s_nationkey FROM supplier WHERE s_acctbal < 500)) AND p.p_name IN (SELECT DISTINCT p_name FROM part UNION SELECT DISTINCT c_address FROM customer WHERE c_acctbal > 2000 UNION SELECT DISTINCT l_shipmode FROM lineitem WHERE l_tax < 0.08) AND p.p_mfgr IN (SELECT DISTINCT p_mfgr FROM part UNION SELECT DISTINCT n_comment FROM nation WHERE n_regionkey = 2 UNION SELECT DISTINCT l_shipinstruct FROM lineitem WHERE l_discount > 0.2) AND n.n_nationkey = (SELECT COUNT(*) FROM (SELECT c_mktsegment FROM customer UNION ALL SELECT l_shipmode FROM lineitem ) t) AND EXISTS (SELECT p_container FROM (SELECT p_container, p_retailprice FROM part WHERE p_retailprice = 20 ) AS subq_10 WHERE p_retailprice > 15 ORDER BY p_retailprice) AND c.c_nationkey = n.n_nationkey AND l.l_suppkey = 3100 AND p.p_retailprice <= 1634.58056625686 AND p.p_brand LIKE 'Brand#53%' AND l.l_discount > 0.08478972825082082 AND l.l_returnflag LIKE 'N%' AND p.p_size > 30 AND l.l_orderkey <= 1493251 AND l.l_extendedprice <= 59952.980535721406 AND n.n_nationkey >= 16 AND l.l_tax = 0.0151119090627878  GROUP BY l.l_partkey, c.c_custkey LIMIT 30;"
16,tpch,"SELECT SUM(l.l_extendedprice) AS sum_l_l_extendedprice, l.l_suppkey AS l_l_suppkey, l.l_shipmode AS l_l_shipmode, AVG(n.n_nationkey) AS avg_n_n_nationkey, l.l_tax AS l_l_tax FROM customer c, lineitem l, nation n, supplier s WHERE s.s_suppkey = (SELECT COUNT(DISTINCT s_suppkey) FROM supplier WHERE s_acctbal BETWEEN 1500 AND 2500 AND (s_nationkey = 5 OR s_nationkey = 6) AND s_phone LIKE '70%') AND n.n_nationkey > (SELECT COUNT(DISTINCT o_orderkey) FROM orders JOIN (SELECT c_custkey FROM customer WHERE c_mktsegment = 'AUTOMOBILE' UNION ALL SELECT c_custkey FROM customer WHERE c_acctbal > 1000) AS cust_union_2 ON orders.o_custkey = cust_union_2.c_custkey) AND l.l_shipinstruct IN (SELECT l_shipinstruct FROM (SELECT l_shipinstruct, l_discount FROM lineitem ) AS subq_3 UNION SELECT r_comment FROM region) AND EXISTS (SELECT l_linestatus FROM (SELECT l_linestatus, l_extendedprice FROM lineitem ) AS subq_4 UNION SELECT r_comment FROM region) AND EXISTS (SELECT MAX(p_retailprice) FROM (SELECT p_retailprice, p_container FROM part WHERE p_size > 10 UNION ALL SELECT p_retailprice, p_container FROM part WHERE p_size <= 10 GROUP BY p_retailprice, p_container) p JOIN (SELECT ps_partkey, ps_supplycost FROM partsupp) ps ON p.p_retailprice = ps.ps_partkey GROUP BY ps.ps_supplycost) AND EXISTS (SELECT MAX(s_acctbal) FROM (SELECT s_acctbal, s_nationkey FROM supplier WHERE s_nationkey BETWEEN 1 AND 5 ) t GROUP BY s_nationkey ORDER BY s_nationkey) AND EXISTS (SELECT COUNT(p_size) FROM (SELECT p_size, p_type FROM part WHERE p_size < 15 ) t GROUP BY p_type ORDER BY p_type) AND s.s_acctbal = (SELECT COUNT(DISTINCT p_size) FROM part JOIN (SELECT ps_partkey FROM partsupp UNION ALL SELECT ps_partkey FROM partsupp WHERE ps_supplycost < 10) AS partsupp_union_8 ON part.p_partkey = partsupp_union_8.ps_partkey) AND EXISTS (SELECT DISTINCT l_extendedprice FROM (SELECT l_extendedprice FROM lineitem UNION ALL SELECT o_totalprice FROM orders) AS u_9 JOIN partsupp ON u_9.l_extendedprice = ps_supplycost) AND c.c_mktsegment IN (SELECT c_mktsegment FROM customer WHERE c_custkey IN (SELECT o_custkey FROM orders WHERE o_orderdate < '1994-01-01' UNION SELECT c_custkey FROM customer WHERE c_acctbal > 5000)) AND c.c_nationkey = n.n_nationkey AND s.s_nationkey = n.n_nationkey AND c.c_custkey >= 23812 AND n.n_nationkey > 23 AND c.c_nationkey < 18 AND l.l_commitdate >= '1992-04-13' AND n.n_name LIKE 'MOZAMBIQUE%' AND n.n_regionkey = 0 AND c.c_acctbal >= -584.3865228079312 AND c.c_mktsegment LIKE 'AUTOMOBILE%' AND l.l_linestatus LIKE 'O%' AND l.l_linenumber < 6  GROUP BY l.l_shipmode, l.l_suppkey, l.l_tax LIMIT 100;"
17,tpch,"SELECT SUM(l.l_quantity) AS sum_l_l_quantity, COUNT(c.c_comment) AS count_c_c_comment, l.l_commitDATE AS l_l_commitDATE, MAX(l.l_orderkey) AS max_l_l_orderkey, SUM(n.n_regionkey) AS sum_n_n_regionkey FROM customer c, lineitem l, nation n WHERE c.c_phone IN (SELECT DISTINCT c_phone FROM customer UNION SELECT c_address FROM customer WHERE c_nationkey = 15) AND n.n_nationkey = (SELECT COUNT(DISTINCT o_orderkey) FROM orders WHERE o_custkey IN (SELECT c_custkey FROM customer WHERE c_acctbal < 800 INTERSECT SELECT c_custkey FROM customer WHERE c_mktsegment = 'HOUSEHOLD')) AND EXISTS (SELECT p_name FROM part WHERE p_partkey IN (SELECT ps_partkey FROM partsupp JOIN supplier ON ps_suppkey = s_suppkey WHERE s_acctbal < 2000 UNION SELECT ps_partkey FROM partsupp JOIN supplier ON ps_suppkey = s_suppkey WHERE s_acctbal > 5000 UNION SELECT ps_partkey FROM partsupp JOIN supplier ON ps_suppkey = s_suppkey WHERE s_acctbal < 1000)) AND l.l_orderkey = (SELECT COUNT(DISTINCT o_orderkey) FROM orders WHERE o_custkey IN (SELECT c_custkey FROM customer WHERE c_acctbal < 500 INTERSECT SELECT c_custkey FROM customer WHERE c_mktsegment = 'BUILDING')) AND l.l_shipmode IN (SELECT DISTINCT l_shipmode FROM lineitem UNION SELECT p_container FROM part UNION SELECT p_container FROM (SELECT DISTINCT p_container FROM part AS p1_5 WHERE p_size < 15) AS subq_5) AND EXISTS (SELECT DISTINCT l_returnflag FROM (SELECT l_returnflag FROM lineitem UNION ALL SELECT o_orderstatus FROM orders) AS u_6 JOIN customer ON u_6.l_returnflag = c_phone) AND EXISTS (SELECT r_comment FROM (SELECT r_comment, r_regionkey FROM region WHERE r_regionkey = 3 ) AS subq_7 WHERE r_regionkey > 2 ORDER BY r_regionkey) AND EXISTS (SELECT MAX(o_totalprice) FROM (SELECT o_totalprice, o_orderpriority FROM orders WHERE o_orderdate <= DATE '1996-12-31' ) t GROUP BY o_orderpriority ORDER BY o_orderpriority) AND l.l_tax = (SELECT COUNT(DISTINCT ps_suppkey) FROM (SELECT ps_suppkey, ps_availqty FROM partsupp WHERE ps_supplycost < 10 ) t) AND EXISTS (SELECT o_10.o_orderpriority FROM orders o_10 WHERE o_10.o_orderkey IN (SELECT l_10.l_orderkey FROM lineitem l_10 WHERE l_10.l_shipmode = 'AIR' UNION ALL SELECT l2_10.l_orderkey FROM lineitem l2_10 WHERE l2_10.l_returnflag = 'N' GROUP BY l2_10.l_orderkey) AND o_10.o_totalprice > 2000) AND c.c_nationkey = n.n_nationkey AND c.c_mktsegment LIKE 'FURNITURE%' AND c.c_name LIKE 'Customer#000006063%' AND c.c_nationkey = 19 AND l.l_tax <= 0.010133814461485686 AND l.l_discount <= 0.05853437116961993 AND l.l_commitdate > '1994-01-08' AND l.l_extendedprice < 24485.7697926519 AND l.l_shipdate >= '1994-04-29' AND n.n_regionkey <= 3 AND n.n_nationkey < 1  GROUP BY l.l_commitDATE LIMIT 100;"
18,tpch,"SELECT AVG(n.n_regionkey) AS avg_n_n_regionkey, SUM(c.c_custkey) AS sum_c_c_custkey, MAX(p.p_container) AS max_p_p_container, COUNT(l.l_tax) AS count_l_l_tax, COUNT(l.l_quantity) AS count_l_l_quantity FROM customer c, lineitem l, nation n, part p, partsupp ps WHERE p.p_retailprice > (SELECT COUNT(DISTINCT o_orderkey) FROM orders JOIN (SELECT c_custkey FROM customer WHERE c_mktsegment = 'HOUSEHOLD' UNION ALL SELECT c_custkey FROM customer WHERE c_acctbal > 2000) AS cust_union_1 ON orders.o_custkey = cust_union_1.c_custkey) AND c.c_custkey = (SELECT COUNT(DISTINCT p_partkey) FROM part JOIN (SELECT ps_partkey FROM partsupp WHERE ps_availqty > 100 UNION ALL SELECT ps_partkey FROM partsupp WHERE ps_supplycost > 20) AS subq_2 ON part.p_partkey = subq_2.ps_partkey) AND EXISTS (SELECT p_3.p_mfgr FROM part p_3 WHERE p_3.p_partkey IN (SELECT l_3.l_partkey FROM lineitem l_3 WHERE l_3.l_tax > 0.1 UNION ALL SELECT l2_3.l_partkey FROM lineitem l2_3 WHERE l2_3.l_discount < 0.2 GROUP BY l2_3.l_partkey) AND p_3.p_retailprice > 200) AND EXISTS (SELECT AVG(l_quantity) FROM (SELECT l_quantity, l_linestatus FROM lineitem WHERE l_shipdate > '1995-03-01' UNION ALL SELECT l_quantity, l_linestatus FROM lineitem WHERE l_shipdate <= '1995-03-01' GROUP BY l_quantity, l_linestatus) t JOIN (SELECT o_orderkey, o_totalprice FROM orders) o ON t.l_quantity = o.o_orderkey GROUP BY o.o_totalprice) AND n.n_nationkey > (SELECT COUNT(DISTINCT o_orderkey) FROM (SELECT o_orderkey FROM orders WHERE o_totalprice > 3000 UNION ALL SELECT l_orderkey FROM lineitem WHERE l_quantity < 15) t JOIN customer ON c_custkey = t.o_orderkey) AND l.l_tax = (SELECT (10 * 7) + COUNT(DISTINCT p_partkey) FROM part WHERE p_size IN (SELECT l_quantity FROM lineitem WHERE l_shipdate > '1995-01-01')) AND EXISTS (SELECT SUM(l_discount) FROM (SELECT l_discount, l_linestatus FROM lineitem WHERE l_shipdate BETWEEN DATE '1998-01-01' AND DATE '1998-12-31' ) t GROUP BY l_linestatus ORDER BY l_linestatus) AND ps.ps_suppkey = (SELECT COUNT(DISTINCT ps_partkey) FROM partsupp WHERE ps_suppkey IN (SELECT s_suppkey FROM supplier WHERE s_acctbal > 5000 UNION SELECT s_suppkey FROM supplier WHERE s_nationkey = 1)) AND p.p_container IN (SELECT p_container FROM part WHERE p_partkey IN (SELECT l_partkey FROM lineitem WHERE l_discount > 0.05 ) UNION SELECT p_container FROM part WHERE p_partkey IN (SELECT l_partkey FROM lineitem WHERE l_discount < 0.05 ) ORDER BY p_container) AND EXISTS (SELECT c_name FROM customer WHERE c_custkey IN (SELECT o_custkey FROM orders WHERE o_orderdate > '1995-01-01' ) UNION SELECT c_name FROM customer WHERE c_custkey IN (SELECT o_custkey FROM orders WHERE o_orderdate < '1995-01-01' ) ORDER BY c_name) AND ps.ps_partkey = l.l_partkey AND ps.ps_suppkey = l.l_suppkey AND ps.ps_partkey = p.p_partkey AND n.n_nationkey = c.c_nationkey AND n.n_name LIKE 'SAUDI ARABIA%' AND l.l_tax > 0.037881238891655025 AND ps.ps_suppkey = 1220 AND ps.ps_availqty > 82 AND c.c_custkey = 8392 AND p.p_mfgr LIKE 'Manufacturer#3%' AND l.l_linestatus LIKE 'F%' AND n.n_nationkey > 23 AND c.c_nationkey < 10 AND l.l_commitdate < '1992-08-08'  LIMIT 10;"
